ProductColor,ProductSize,ID,score,sentimentScore,content
DF700Flux风行者(5把风扇),,20595290713,5,0.9999999892767945,质量没得说，跟专卖店一样，特别特别喜欢，而且价格优惠质量没得说，跟专卖店一样，特别特别喜欢，而且价格优惠质量没得说，跟专卖店一样，特别特别喜欢，而且价格优惠质量没得说，跟专卖店一样，特别特别喜欢，而且价格优惠
C5 海景房机箱 ARGB灯条 ,,20650552239,5,0.9999992724536033,内部空间：内部空间大，和风扇搭配起来特别棒做工质量：做工质量很不错，有质感散热效果：散热好外形外观：纯黑百搭产品包装：包装严实，物流快，下单第二天就收到货了，售后处理及时，很满意！
,,20680733823,5,0.3945930353320036,空间大，理线也很方便，放得下旗舰4080显卡，水冷也能夹汉堡，配上海盗船风扇，颜值真的没话说，散热也很好
DF800 FLUX 星曜者（神光同步）,,20449793216,5,0.021784325116112724,机箱非常重，做工用料应该很好。内部空间很大，可以装各种类型的主板。背部走线有沟槽，可以走的非常好看。完美支持神光同步，机箱附带的风扇颜色非常好看，搭配上内存和cpu风扇，科幻感十足。风道设计也很合理，烤机温度压的很低。另一台电脑，机箱是DF700，这次配的DF800灯的颜色确实更进一步
Performance1 FT 初星 全塔侧透,,20427097390,5,0.9942983546582895,内部空间：机箱内部设计非常的大做工质量：机箱外壳非常的厚。散热效果：前后风机静音，散热非常好外形外观：外观设计非常的大气，产品包装：外包装无破损，内部泡沫防震措施非常到位。
DF700Flux风行者(5把风扇),,20427973606,5,0.9999995408314425,棒棒棒，东西便宜，而且质量好，物美价廉，买的放心，用的开心，感觉都买上瘾，买买买，根本停不下来，东西品种多，而且又特别全，划算方便，包装很好，而且没有任何损坏，会一直支持京东！
DF700Flux风行者 白色,,20504181926,5,0.9998651332068117,安钛克Antec风行者DF 700 Flus 白色中塔钢化玻璃材质机箱 内部空间极大 这样直接体现出的好处就是散热效果特别好 做工精良 各种插件及配件端均没有一丝划痕毛糙的现象 外观大气上档次
P20C ARGB (Type-C),,20526097580,5,0.99999884741936,收到货后包装很厚实没有破损，拆开包装后实物和商品描述一致，材质和做工超出我的预期让人很惊喜！使用功能快捷简单方便，物有所值，名不虚传，相信品牌的力量！机箱性价比不错，自带三把风扇和集线器，做工也很好，期待效果！
Performance1 FT 初星 全塔侧透,,20590535796,5,0.9999999824955973,看了很多款式的机箱，唯独比较钟爱这款。到货以后实物的效果很不错，低调但是很有设计感，不愧是红点设计奖的获奖产品，机箱设计的很人性化，装机拆装非常方便，内部空间很大，装4090都很富裕，自带风扇，散热效果很好，整体产品的质量和细节都很到位，是一款很有性价比的产品。
DA601复仇者X(网红机箱）,,16131335132,3,0.9383196525916125,好歹也弄个装机视频吧...就给了几张图片，新手哪里看得懂
DF700Flux风行者(5把风扇),,20421219830,5,0.007458412094114686,已经装进机器里了，没办法拔出来再拍照片，目前用了两天，十分流畅，装好系统之后，联网会自动提示安装辅助工具，非常方便，期待后续表现。
Performance1 FT 初星 全塔侧透,,20460801573,5,0.2435998153844946,不得不说这机箱真的大，也很有份量，装起来还是比较轻松的，标配的风扇也够用，我电脑14700kf+7900xtx在这机箱里面可以完美发挥性能
平头哥M2  (五风扇位 全透玻璃),,20617715071,5,0.9543112278364735,机箱很紧凑，做工也还可以，就是提醒大家，显卡大的别买这个，看我显卡都快落地了。。。。。而且matx的板子配大显卡，真的好丑。。。。哈哈哈哈
平头哥M2  (五风扇位 全透玻璃),,20611479663,5,0.9986828897400188,做工质量：做工精细，前端USB有待提高。散热效果：可以装5个机箱风扇，散热效果不错。内部空间：内部空间大，五星好评。外形外观：★外形尺寸合适，左侧玻璃装饰效果拉满。
平头哥M8 (360水冷位 八风扇位),,20656304209,5,0.6309958603921332,这个机箱超级有质感，看起来就很有档次那种。机箱也非常的小巧，不像传统的机箱那么大，放在我的小桌子下面刚刚好，真的很喜欢。要买机箱的可以放心冲。连人影都可以透出来，真的很不错。
平头哥M2  (五风扇位 全透玻璃),,20671807307,5,0.9999683659950582,内部空间：如图，老爸的电脑用不了了，换了这个，还没弄好，做工质量：帮忙买的，质量应该可以，散热效果：散热很快，希望电脑能快点运转起来，外形外观：如图所示，包装很好，物流速度很快。
平头哥M2  (五风扇位 全透玻璃),,20613995213,5,0.9999995539431346,发货很快，包装的很好，价格也特别实惠，还有这么多功效也是不错了，值得购买是正品，跟商店里买的是一样的，在这网购方便快捷，品质放心，还会光顾！.^^.
【新品】幻境界 黑色,,20652356497,5,0.8015138075316057,空间很赞，设计也不错，顶部支持360冷排，机箱整体通透，通风性能比较好，前面大块的侧透玻璃很有质感，比老机箱的亚克力板不知好了多少倍。家住的偏，平时正常购买都是3天左右才到的，这次物流超快啊，从未体验过当天买隔天到的
平头哥M2 Pro (ATX机箱),,20692065712,5,0.31254937805175065,外观好看，侧透玻璃很有质感，可以接六个风扇，不闷罐，顶部有防尘网，磁吸的也很好清理，前面usb接口很多很方便。物有所值很推荐购买
平头哥M2  (五风扇位 全透玻璃),,20692039283,5,0.9981535543414289,先马这款机箱背线很好走，设计很人性化，做工很扎实。可以安五个风扇，散热效果也很好的。内部空间很大，一般显卡都可以放进去。
平头哥M2  (五风扇位 全透玻璃),,20651806782,5,0.00021393364919963798,一个设计相当中庸，装机绝对不会出错的机箱。机箱结构合理，3风扇335的7800xt显卡放进去完全没问题，常规matx箱形，兼容性很好，159的t400i放进来压126kf也绰绰有余，风道的话做前后比较好，上下有点顶风扇，没太大必要。总体来说绝对是典范机箱，非常适合小白不出错的装机。
【新品】幻境界 黑色,,20606872412,5,0.9999999338087743,内部空间：空间非常大，支持360水冷，不谈，什么显卡的长度都是够的做工质量：做工扎实，非常有分量外形外观：外观非常美观，不愧是海景房产品包装：包装厚实，非常结实，送过来的时候四角尖尖
平头哥M2  (五风扇位 全透玻璃),,20648064487,5,0.8778778032664102,京东快递很快，次日达的，售后也不错，，电子产品都是买的京东自营的，机箱不错的，颜值很高内部空间：挺大的，布局也合理，走背线方便的，
平头哥M2  (五风扇位 全透玻璃),,20648345604,5,0.9158024639592425,机箱不错，选的没有带灯的，深邃的黑，看着舒服太多了。机箱整体也挺紧凑的。用料也足，最好的一点就是预留了前置c口，完美。
新品 平头哥M2 Pro白（ATX机箱）,,20599594560,5,0.9982718975314582,先马的小朱雀之前用了很多，很不错 这次又买了平头哥M2Pro，白色外观非常大气，内部空间合理便于散热，支持长显卡！！！！！
平头哥M2 Air 黑色(配Type-C),,20649279456,5,0.9999314505616894,东西很好，拿来做办公平台的，侧面不是玻璃而是打孔金属结构非常的适合办公属性，而且偶尔玩玩游戏散热也非常的好，内部空间也大，非常的不错
【新品】幻境界 黑色,,20599592046,5,0.9999337553325919,机箱比以前的航嘉好，而且做工精细，材料厚实，从没想过这么实惠的价格，能买到这么好的宝贝，性价比非常高，我很喜欢哦
平头哥M8 雪装版(颜值小箱),,20600003212,5,0.9920496532141133,快递非常快，一天就到了，机箱也很不错，外观好看，比较结实，同时也不算太沉，安装很方便，总体来说是非常不错的，非常赞！！！
新品 平头哥M2 Pro (ATX机箱),,20617081644,5,0.9999998155908132,电脑机箱，设计精良，外观简约而不失大气。内部布局合理，散热性能卓越，为电脑运行提供稳定环境。材质坚固，经久耐用，彰显品质之选。细节之处更显匠心，接口丰富，扩展性强，满足各类需求。电脑机箱，确实非常好。
平头哥M1  (五风扇位 全透玻璃),,12774221592,3,0.5932896313939331,说多了都是泪，你们自己感受
平头哥M2  (五风扇位 全透玻璃),,20627520681,5,0.9926879172046492,这个小机箱价格实惠真心可以整内部空间：空间装m-atx没问题，硬盘位好多，实际我也没用上做工质量：做工质量都可以，钣金对得起价格，边缘处理的很好没有毛刺不划手散热效果：风扇位很多，我这配置不高没装散热风扇，夏天看看外形外观：商务+测透，商务又时尚，哈哈哈，机箱宽度较大，挺好的产品包装：纸箱+泡沫，正常包装
平头哥M2  (五风扇位 全透玻璃),,20666201514,5,0.999999999009344,内部空间：很大，可以容纳各种配件。做工质量：十分好，保护性嘎嘎强！散热效果：侧面和天花板两处散热区域，特别好！外形外观：十分漂亮，黑色高端大气上档次！产品包装：保护性很好，两边有泡沫板保护，稳稳地很贴心。快递隔天到，京东快递赞！
S980龙卷风白色全景版,海景房游戏系列,20617869669,5,0.9636765531527361,质量很好，非常好用的一款电脑机箱，很通风透气，就是有点重，说明质量好，其他方面还挺满意的，配一些白色的配件看起来特别好看 很大气
S960暴风雪X白色全景版,海景房游戏系列,20652945508,5,0.9999975145305579,终于收到我需要的东西了，东西很好，价美物康！ 说叉在，这是非常满志的-次购物。无论是店家的态度还是对物品，都非常满意的。店家态度很专业热情，有间必答，回复也很快，非常感谢店家。再说物品，正是我需要的，到的时候包装完整！不得不得竖起大拇指。性价比非常高，值得入手
GS400C黑色,GS主流游戏系列,20620217410,5,0.9999999934032631,我来评价下这个宝贝，价格不错，质量不错，快递不错，老板不错。商品质量不错，细节、品质、做工都非常好，发货贼快，快递也给力，棒棒哒~宝贝收到了，和实物描述的一样，每年都必买，首先这家，发货速度很快，物美价廉，值得大家放心购买
S980龙卷风黑色全景版,海景房游戏系列,20672928449,5,0.9452809400808857,第一次买航嘉的机箱 还是海景房 纯黑海景房 非常喜欢 网上一直看 很心动 然后就下单了 哈哈哈哈哈 确实好看 黑武士风满满 给好评了
超越黑色,Micro桌面系列,20671700499,5,0.7841800313633667,稳定性能：一直都是用航嘉的机箱，公司好几台电脑都是用这个。静音效果： 购买的就是冷静王型号的。方便在房间里玩电脑的时候，噪音不会太大，而且效果也很好。散热效果：散热效果杠杠的，机箱里边的热量一般都给电源抽出去了。外形外观：包装精美，路途遥远，就算物流碰碰磕磕也没有摔坏外包装。
超越黑色,Micro桌面系列,20624397761,5,0.4576012882224527,航嘉机箱质量很不错，使用起来很方便，而且预留的机械硬盘很合适，物流隔天就到了，小巧机箱，在公司放进柜子里刚刚好，总体还是很不错的
S980龙卷风白色全景版,海景房游戏系列,20662096138,5,0.04870678492198066,机箱非常好看，整体白色，海景房机箱，必须风扇拉满，自己安装也很方便，配有说明书而不是电子档，这点好评，很满意的一次装机体验。
S960暴风雪X白色全景版,海景房游戏系列,20665067289,5,0.9999960866192008,外形大气稳重 质量很好  做工精细  安装也很方便  京东物流就是快 买东西送的及时  自己diy的乐趣很好  散热很不错
S960暴风雪X白色全景版,海景房游戏系列,20644678089,5,0.8732978766552819,非常好看，机子也组装起来了，把旧电脑换掉，可以美的玩游戏，一开始买了不匹配13600kf的主板，后面换了微星迫击炮wifi版，wifi信号也不错，海景房无敌
超越黑色,Micro桌面系列,20670556408,5,0.996982455000126,航嘉的机箱，行家的选择！内部的空间简直就是装机的空间！做工质量肉眼可见！散热的效果得看风扇！外形外观黑色沉稳大气，商务风满满！
超越黑色,Micro桌面系列,20641664401,5,0.999999707148908,用评论80字以上可以得到50个积分，我无论买什么东西都会把这段话复制粘贴一下，凑够字数。这是第n次在网上买东西啦，棒棒棒东西便宜，而且质量又好，物美价廉，买的放心，用的开心。根本停不下来，东西品种多，而且又特别划算方便而且实惠，包装很好，而且没有任何。损坏会一直支持下去。服务很好，也很好用。好评，下次再来。
GS400C黑色,GS主流游戏系列,20621633950,5,0.9999968446888674,机箱很不错，性价比挺高的，对主板的支持也挺到位。前置接口也足够用。板材也还行。包装到位。京东配送不错美中不足要是侧透是一块玻璃就好了
超越黑色,Micro桌面系列,20672754455,5,0.9999999861183357,第一次东西确实不错值得大家一起用，价格实惠！好东西值得推荐一下，东西实惠，送货速度也快，值得推荐！好东西大家一起分享一下吧！买了就知道了！确实不错！物美价廉，超出你的想象。
S980龙卷风白色全景版,海景房游戏系列,20676852530,5,0.9706439066762931,感观如评论图，非常魅力的海景房，机箱设计很好各种地方可以用来串线理线，好好弄的话整体非常完美，玻璃的外壳让机箱整体通透富有高级感
S960暴风雪X白色全景版,海景房游戏系列,20615323288,5,0.9969751559449997,这款机箱在网上选择了好久，最后选择了航嘉s960x暴风雪全景版白色，非常好看 ，白色的很喜欢，自营旗舰店也很放心，下次还会来购买
S980龙卷风黑色全景版,海景房游戏系列,20596828728,5,0.6324165951575289,不错挺好的，包装很好很仔细，快递也很快很负责，到手后发现很值得，虽然第二天有活动送了***，差价退不了，也懒得退货重新买了，不过东西值得吧
GS500C,GS主流游戏系列,13874047187,3,0.34527875471283087,为了京豆，我也是不容易啊
超越黑色,Micro桌面系列,20674638799,5,0.9999999999962501,是正品，而且价格不贵，用着也很大气，一直在用，很好挺好的，目前没问题，后续追评质量很好，买的很合我心意，棒棒哒！需要的亲们可以放心购买质量很过关，品质有保障，相当不错的选择，好多朋友看我用都想买，我都推荐了质量很过关，品质有保障，相当不错的选择，好多朋友看我用都想买，我都推荐了超出预期，质量很好，做工精细，满意
S980龙卷风黑色全景版,海景房游戏系列,20656262615,5,0.9999687327360651,内部空间：空间设计的比较紧凑，也挺合理，下置电源和下置硬盘不错，是主流设计，也不会和内存打架。做工质量：非常规整，没有毛糙，主要结构处铆钉坚固紧实散热效果：前进后出，配好风道应该没问题。外形外观：简单大方，前后距离35，非常省空间！产品包装：不错，送到家都没什么磕碰。
超越黑色,Micro桌面系列,20693340637,5,0.999996081877714,"1、真的超级喜欢，非常支持，质量非常好，与卖家描述的完全一致，非常满意,真的很喜欢，完全超出期望值，发货速度非常快，包装非常仔细、严实，物流公司服务态度很好，运送速度很快，很满意的一次购物&nbsp; 2、先说商品质量：产品总体不错，包装严实。再说商家服务：点赞啦。最后点评快递：发货很快。其他就是感谢店家打折送券活动，毕竟便宜好货更实在。希望店家多多优惠，及时通知老客户，促成回购。祝生意兴隆。"
风行者 DF700 FLUX,,20531767380,5,0.0010706542518762463,机箱空间很大，送的风扇不错，安装也方便，还带了集线器。本人新手第一次装机，线走不好勿喷谢谢过一两个月换4070
AX61,,20267485906,5,1.0,宝贝收到，一如既往的好，包装很到位，质量还不错，很喜欢，大品牌值得信赖超级好用！还很美观！墙裂推荐！有需要再回购！(&bull;&bull;)价格超优惠，性能也非常棒，完美的一次购物(*^__^*)非常满意的一次购物，物有所值，比实体店里实惠多了！五星好评，非常好！想不到那么快就到了！是正品，和实体店一样，价格还优惠，果断转粉宝贝做工真的非常精细，细节真的棒，爱了爱了宝贝收到了，包装很结实，应该是个好东西，先给好评了
AX90,,20139528309,5,0.9750745999494755,安钛克，ax90风道，王者。和乘风一样，风道，好质感，也不错，性价比高。还没装机，后续，装好机在来追平。
复仇者X DA601,,19297425636,5,0.999747517148285,安钛克复仇者这款机箱我很喜欢，本来打算配个海景房机箱的，最后还是被复仇者吸引了，外观大气上档次 重量可以，东西陆陆续续到了 没时间安装 等安装好了 再追评上图
DA601+HCG750W GOLD,,16168382402,5,0.008322292872529391,机箱自带前后风扇，前面带灯，配安钛克750w电源很安静，机箱比想象的要大，机箱背面的主板灯光同步等，不会设置，希望卖家提供教程，小白真心不会，总体很好，有不会的卖家也耐心解答
复仇者X DA601,,18123510334,5,0.9963062891600394,机箱非常棒，静音效果很好内部空间：大做工质量：满意散热效果：好
风行者 DF700 FLUX 白色,,18204954966,5,1.0,宝贝收到，一如既往的好，包装很到位，质量还不错，很喜欢，大品牌值得信赖超级好用！还很美观！墙裂推荐！有需要再回购！(&bull;&bull;)价格超优惠，性能也非常棒，完美的一次购物(*^__^*)非常满意的一次购物，物有所值，比实体店里实惠多了！五星好评，非常好！想不到那么快就到了！是正品，和实体店一样，价格还优惠，果断转粉宝贝做工真的非常精细，细节真的棒，爱了爱了宝贝收到了，包装很结实，应该是个好东西，先给好评了
复仇者X DA601,,17175896913,5,0.9999163027160682,外观超级酷炫，做工厚重有分量明显比两三百价位的好很多，非常有质感。
DA601+HCG850W GOLD,,14896508206,5,0.9999476742071799,做工质量：很好，外形外观：很好内部空间：很大，足够放下360水冷，甚至双360水冷也行散热效果：不错，最好是自己额外购买一些风扇，将所有风扇位装满，以达到更好的散热效果
复仇者X DA601,,14947116183,5,0.997309685157147,内部空间：非常大做工质量：还不错外形外观：太帅了产品包装：很严实
风行者 DF700 FLUX,,18789469801,5,0.1915319413101776,包装的很好，自带的风扇好评。机箱颜值也很高。
复仇者X DA601,,14503689389,5,0.9999972428120034,内部空间：超级大，空旷做工质量：不错，重量蛮重，用料足散热效果：空间大散热好外形外观：外观酷炫，RGB灯非常好看产品包装：安装好，保护单位
星曜者 DF800 FLUX,,17303614292,5,0.1385434232029913,包装的很好，现在配件还没到齐。还未安装。
复仇者X DA601,,14146371849,5,0.9986302751545013,这是一款非常棒的机箱！非常棒！做工材质都是一流，外观拉风酷炫，内部整洁设计合理空间大！表面不划手不粗糙！机箱自带2个风扇，1包安装配件非常人性化到位！机箱还真沉啊我的小桌子都受不住了~没关系我新买个结实的桌子放它！客服耐心指导热心服务好谢谢。 图片拍好上传真很棒
弑星者 DP301M,,14885466567,5,0.9853101114033785,店家包装的很仔细，非常放心，机箱做工很好，设计合理，内部空间很大，走线方便，灯条好看 价格也优惠。需要小机箱首选。
弑星者 DP301M,,14938894583,5,0.9998642378520549,内部空间：B460主板刚好做工质量：没得说，很好散热效果：后面自带一把风扇外形外观：很喜欢产品包装：没有破损 很好
安钛克 DF800 FLUX 星曜者,,17020668041,5,0.9985566617904063,这个机箱很不错，风道一流，空间放得下的话，性价比高，值得购买
复仇者X DA601,,14389627077,5,0.9993455115540875,内部空间：内部空间完全OK做工质量：质量可以外形外观：外形好看产品包装：包装严实散热效果：散热绝对没问题
风行者 DF700 FLUX,,19094235263,3,0.15017142441180675,东西还行，商家服务态度一般
复仇者X DA601,,14734298117,5,0.9999933358786878,内部空间：挺不错的做工质量：很好外形外观：帅气，霸王！产品包装：是真的安全，防摔啊
机遇003,,20644812221,5,0.16015250520723512,从网上看了很多小型机箱，最终选择这个积至（EVESKY）灵悦迷你小电脑机箱，材质拉丝面板，M-ATX小主板完美安装，这个价位完美
机遇005,,20599482672,5,0.9999987247630078,机箱很小巧，质量不错。很适合办公室给员工使用，节约地方。整体设计很好，使用手感也很好，一次性买了两套，都是这家店的，好评！ 卖家的服务真是周到细致！他们不仅耐心解答我的问题，还给予了很多实用的建议。物流速度也很快，让我及时收到了商品。
机遇005,,20679846539,5,0.9996359971024814,挺不错的机箱我，做工挺好的，还能走背线。物超所值的机箱，办公家用很合适。
机遇003,,20618102521,5,0.992318203886023,非常好用 值得购买 物流非常快 质量很有保障
机遇005,,20681911187,5,0.004158946114475426,机箱不错，服务态度也好，侧板坏了立马给补发
灵悦,,20333671973,5,0.7891683746909343,机箱小巧，质量还行，
机遇005,,20675174916,5,0.6986102074041107,价格便宜，还是可以的。
机遇003,,18888546336,5,0.9965026624355543,机箱很小巧，质量不错。很适合办公室给员工使用，节约地方。整体设计很好，使用手感也很好，一次性买了两套，都是这家店的，好评！
机遇003,,19307629848,5,0.9999993537972559,真的是很不错 ，本人超级喜欢，再次感谢店家让我拍到了物美价廉的东西 我会一直关注你们家的产品哦。已经向身边的朋友多次推荐过你们家的产品了哦。我再来购买的时候希望店家多多给我便宜些哟，呵呵，好的产品是非常值得推荐的，超好用！稳稳的！满分
机遇003,,19325067610,5,0.999923417382665,电脑机箱十分小巧，便捷适合办公室等场合比较小的地方，机箱电源是在上面，整体的强度还是比较高的耐摔。发货也很快，机箱前置接口很多整体做工很好，50块钱能买到这么好的机箱，已经很棒了。
机遇003,,19161033444,5,0.6243754589468842,很好，小巧玲珑的，装什么设备都行，因为我是用边公的，不需要太多的硬件。所以说这个刚刚好，比起实体店的更加好，下次再需要到再买
机遇003,,19081734352,5,0.9999913547326702,很好内部空间：很好做工质量：很好散热效果：很好外形外观：很好
灵悦,,18702838153,5,0.19776393317088636,机箱收到了，相当小巧，比我原来的机箱小一大圈，完美
机遇003,,19181409451,5,0.9999973896401656,到货速度还行，做工一般空间来说就是支持mini主板散热效果还算可以吧，电源上置，外形外观中规中矩，四四方方比较迷你，标准的纸箱加泡沫的包装方式，硬要说缺点的话，就是这个价位下，他只能买到铁皮机箱，肯定不是钢板的
机遇003,,18871931958,5,0.9999810533009466,性价比高 送货快 服务好，有需要再回购！性价比高 送货快 服务好，有需要再回购！性价比高 送货快 服务好，有需要再回购！性价比高 送货快 服务好，有需要再回购！
灵悦,,19631408034,5,0.7273214176567854,可以，机箱小巧，刚好放得下。
机遇003,,19216888492,5,0.9991357474369387,小巧轻便的机箱，办公使用经济实惠。
灵悦+积至700WS电源,,19322703859,1,9.239154077911316e-06,他家的机箱一般，配的电源真的垃圾，真就一分钱一分货，还没用就坏了，我他喵还以为我的配件有问题，唉，一次不好的购物体验
机遇003,,18836958651,5,0.9415227860949036,不错。可以的。推荐购买。
机遇003,,19199355956,5,0.06333691759012594,机箱很小巧，装机也不费事儿&hellip;
