ProductColor,ProductSize,ID,score,sentimentScore,content
,,20552958104,5,1.0,刚好做活动，价格便宜了很多，性价比超高，真的特别划算终于买到满意的商品了，超出期望，非常喜欢，身边的人都问我要链接价格实惠，质量杠杠的，非常好的一次购物，下次还来非常值得信赖的品牌，质量有保障，价格还亲民，相当满意款式很大方，质量非常好，价钱也很合理宝贝收到了，很惊喜，质量非常好，很满意的一次购物。我会继续回购的，店家值得信赖用了觉得很不错，商品质量好，发货也挺快的，总之就是很赞了很精致，质量非常好，很满意的一次购物。谢谢店家！发货快，包装严实，商品质量非常好，比专柜便宜很多，客服服务态度也特别好，好评东西不错，还有优惠，可以放心省钱购买，不要犹豫了
经典风味5包,,20650975078,5,0.9999994695176401,最近减肥啦但是嘴巴又太寂寞了，就特别想吃方便面，今天终于吃到了来一顿美美的欺骗早餐吧，制作非常方便，我喜欢吃硬一点的面，煮了2分钟吧，捞出把调料都放进去，搅拌吧，是拌面的意思了面条很劲道，调味料里有甜辣酱，一口下去就有那种东南亚美食的感觉啦，有点酸酸辣辣的，咀嚼几下面条很弹的同时又嚼到了脆脆颗粒，很像炸鸡的小碎**很香，太解馋了所有味道都有一种很克制的感觉，搭配在一起又很和谐，不会像三养火鸡面那样辣，主要它小小一包，不会吃多很好控制量，很适合减肥太馋的时候吃一下又解馋了又没那么多的罪恶感。不减肥的可以多煮几包哈，真的是超高性价比的一款拌面了。
经典风味5包,,20545349664,5,0.9999291017415067,京东的商品都收到了，当天下单隔天送到，还送货上门非常方便，省时省力省心，京东秒杀购买的，价格非常实惠！京东Puls实行无限免邮后让我实现购物自由，看到有优惠就下单，太爽了！
经典风味5包,,20639094759,5,0.9966886674081088,在印尼旅行时，就喜欢上了这个。挺不一样的东南亚特色美味，拿来拌，好吃，面也很Q，不会很大包，刚刚好吃个过瘾，又不会太撑，挺好的。
经典风味5包,,20652928105,5,0.39656981575244177,这段时间突然想吃干拌面了，记得小时候康师傅刚推出的第一款干拌面炸酱面就很好吃，现在的干拌面品种是越来越多了，看起来每一种都非常的诱人，这一次买了好几个品牌好几个口味的干拌面都很好吃没有一个让我失望，这一款印尼产的也非常的好吃家里人都爱吃，唯一不足就是面饼太小了量不大，更适合不太饿的时候吃，里面的洋葱碎特别香，比我在国外吃过的营多米好吃，那个是捞面调味料单一所以在国外他们都是自己加配料炒着吃，这一款印尼的方便面比那个好吃太多了。
炸鸡风味5包,,20613981190,5,0.7712789242846256,一直都在京东自营店买东西，价格实惠又保证，下单京东快递送货上门也快，一般都是隔天送到门口，吃的洗的穿的一条龙服务，很不错，送到门口没人在家每次都打电话提醒拿回家里。
经典风味5包,,20603968561,5,0.9999964116844274,在京东购物方便快捷，品质放心，物超所值。配送非常快，包装非常仔细，东西收到完好。产品值得购买，很满意，会再次购买，会推荐给身边的人。
经典风味杯面单杯,,20574994815,5,0.999999115438069,辉英喜达印尼拌面是一款令人难忘的美食。这款泡面采用优质原料，口感鲜美，酸辣甜三种口味的酱料搭配的恰到好处，让人回味无穷。同时，面饼Q弹有嚼劲，背面设计也很方便携带是旅行学习的绝美伴侣。
炸鸡风味5包,,20585849424,5,0.9993534135847578,这是我购物来让我最满意的一次购物。质量非常好，非常满意，真的很喜欢，完全超出期望值发货速度非常快，物流公司服务态度很好。
经典风味5包,,20604289970,5,1.0,终于对它下手了，颜值是真的没话说，材质很好，物美价廉，趁活动赶紧囤起来大小合适，做工精良，出口品质，最满意的一次淘货，很喜欢，下次会再来！从没想过这么实惠的价格能买到这么好的宝贝，下次还来你家在这里选购安全方便快捷，快递小哥态度非常好，这个价格非常给力，十分推荐，会继续回购宝贝收到后很满意，外形颜色也很喜欢，挑选好多家，果然没看错，希望把好物分享给大家宝贝收到啦，实物真的好看，价格非常实惠，强烈推荐这款，超级喜欢整体来说，还是很好的，非常值得再次回购每一次都很满意，这次选的宝贝更加满意，以后还会一如既往地买下去上次买到这么好用的东西还是上次！东西不错，还有优惠，可以放心省钱购买，不要犹豫了品质一级棒，包装也不错，物流很快，而且价格合理，很实惠，很喜欢宝贝已收到，是我想要的，手感很好，质量也挺好，有问题客服也很快就解决了，态度非常好，一定好评！
经典风味5包,,20341557967,3,0.997590940319645,个人感觉口味一般，京东服务不错，值得点赞
经典风味450g*8袋整箱装,,20572815963,5,0.995058945162918,第一次买了一袋   现在回购买一箱    味道很不错   打开新大陆了  哈哈哈哈哈哈   好吃   送货也快  666666666
【经典袋面】红烧牛肉5连包,,20587180931,5,0.990898281365135,"BZ每袋合到八元多,购物方便快捷,早上下单过午就到了,因为刚好有券做活动,康师傅红烧牛肉面太值得信赖了,很喜欢这款番茄鸡蛋味,日期新鲜出炉,快递也很好,从小就喜欢吃康师傅红烧牛肉面,家里的东西一直在京东上买,价格真的超级合适五星好评~"
【杨紫推荐】番茄鸡蛋牛肉5连包,,20543447050,5,0.9540384624094157,京东自营，商品没问题。生产日期很新，物流速度非常快。很喜欢这款番茄鸡蛋味，汤不是很油，喝起来不错。囤着下班应急
【上新】双萝卜牛腩面5连包,,20562372835,5,0.9297004542202315,新口味买来尝一下，晚上下的单隔天就到了方便快捷，现在感觉这个口味还不错，这个面用锅煮才好吃因为面更劲道一些，康师傅面很不错。好吃以后再买。
【经典袋】酸菜牛肉5连包,,20613612194,5,0.9992763655649546,老坛酸菜，吃起来很是不错，特别是肚子饿的时候。刚好买来这次出差用，很久没有长时间坐火车了，有东西吃还是很不错的呢，网上确实比实体店要便宜很多！
【周深推荐】老母鸡汤面5连包,,20585751491,5,0.04332602464536717,孩子不能吃辣的，所以说就选的这款老母鸡汤面，味道很不错，吃了几十年还是离不开方便面的味道，这辈子看来是吃不腻了，吃不够。孩子不能吃辣的，所以说就选的这款老母鸡汤面，味道很不错，吃了几十年还是离不开方便面的味道，这辈子看来是吃不腻了，吃不够。
【经典袋面】酸菜牛肉5连包,,20559123706,5,0.9999364054997663,这是我常购的商品，味道好性价比高，面饼大，刚好可以吃饱，酸酸辣辣的，特别喜欢这个味道，物流快态度好。京东商城，值得信赖，五星。
【经典袋】双萝卜牛腩5连包,,20612807509,5,0.9999999999946505,康师傅方便面好吃，这款带胡萝卜的牛肉面，汤汁特别的香，味道很浓郁，比单牛肉面更好吃。而且价格还便宜，非常不错的活动。京东购物质量有保证，省心，物流快，基本都是当日达，次日达。很满意的一次购物，收到的商品和图片一致！描述的很准确，商品质量也不错！物美价廉，性价比很高！发货速度很快，包装也很完整！卖家服务态度很好，沟通顺畅，回复及时！快递速度很快，物流服务很棒！
【经典袋】双萝卜牛腩5连包,,20620308023,5,0.9292192522311317,在网上看见很多人是哦这个味道的好吃，就买来试试啦。还想着萝卜能有多好吃呢。不过我还没有吃啦。物流很快，同城每次都是第一天下单，第二天就送到了。上次买到这么好用的东西还是上次！
【周深推荐】牛尾汤面5连包,,20580654046,5,0.7273742706950088,没想到深深代言的产品这么好吃！年货节搞促销买入简直太划算了。说是牛尾汤面，其实是四川火锅底料味道的泡面，但是确实很好吃，一口气吃了四袋，希望再有活动啊
【经典5包】酸香爽金汤肥牛5连包,,20589362846,5,0.9999990060296485,十几种口味，永远吃不腻！！最爱泡椒和酸菜！！！巨好吃嘻嘻嘻，当时买的时候还在犹豫价格，买来之后一点都不后悔，而且物流还快，可以入手 这个商品超出了我的期待！不仅质量上乘，而且功能齐全，性价比很高。卖家的服务态度也非常好，让我有了愉快的购物体验。
【周深推荐】老母鸡汤面5连包,,20592457037,5,0.9999999685042827,性价比很高的  康师傅方便面 老母鸡汤 泡面袋装速食 五连包  周深代言      ，宝爸宝妈亲测有效家有大宝二宝，都很喜欢值得信赖，可以无脑下单哟昨天下单，第二天就到货了，京东快递速度就是快，值得信赖。主要是性价比高，值得五星推荐，值得大家购买～会回购的。
【经典袋面】鲜虾鱼板5连包,,20560434484,5,0.11138499682824388,发货速度很快，包装完好无损，日期新鲜出炉。独立小包装设计，方便携带和食用，一直喜欢清爽的鲜虾味道，面身劲道，不会泡烂的那种。
【经典袋】双萝卜牛腩5连包,,20619011826,5,0.9999543921921316,大萝卜很白很甜。洗完之后很顺滑，猫狗都爱吃，尺码很合适，穿上身后微调一下声音很清脆不打品，很小的水压就能220v稳压疏通经络，很省天然气，一点就能充分燃烧整个房间的芳香，骑行携带方便收纳，2吨的重量放在口袋就能飞到4公里外信号接受无干扰，一键自动摔到地上也不会坏，孩子爱吃。
【经典袋】红烧牛肉5连包,,20651593152,5,0.5257225933331977,方便面，口感好，很好吃，很新鲜，味道很好物流很快，昨天下单，今天就收到了，还没用，先给好评！包装很好，没有破损，打开后没有异味
【经典袋】鲜虾鱼板5连包,,20648406224,5,0.9987978087503433,这款非常好吃，试买了好几款，发现这款最好吃，，以后选定这款，京东买东西方便，价格实惠，最重要的是物流方便，都是送货上门，点赞
【经典袋】红烧牛肉5连包,,20649875580,5,0.9998762354718694,从小就喜欢吃康师傅红烧牛肉面，孩子也喜欢吃!时不时地吃吃下很好吃!超爱家里的东西一直在京东上买，方便快捷，物美价廉!送货也快!而且送到家很方便
【经典袋】金汤肥牛5连包,,20618265671,5,0.781818576885302,京东速度，晚上下单第二天上午到货给力。特别入味，面饼很大，面条劲道好吃，生产日期非常新，放心购买，吃完还会回购的，价格实惠。
【周深推荐】老母鸡汤面5连包,,20587791993,5,0.9999926993434834,康师傅老母鸡汤面，新口味，之前没怎么吃过，好吃不错，外观和描述一致，完全超出期望值，发货速度非常快，包装非常仔细、严实，运送速度很快，很满意的一次购物。京东自营的产品品质有保障。
,,462365440,3,0.7722026677624787,物美价廉送货上门产品
【周深推荐】老母鸡汤面5连包,,20584074756,5,0.9999270897089919,康师傅方便面，质量保证，特别是老母鸡汤面，香味十足，特别是汤非常好吃的，老母鸡高汤包配味非常好吃，物优价位，京东自营物流很快，今买明到手，0k。
【15袋】多口味干拌面混合,,20620912448,5,0.9820272460534385,买了很多口味的，大辣椒，麻椒，小龙虾等等，麻辣面我已经吃完了！很好吃，不过我买错了我应该只买一种口味的。建议大家再买点搭档会更好！
【10袋】多口味干拌面混合,,20643269567,5,0.9999940814826456,质量非常好，与卖家描述的完全一致，非常满意，真的很喜欢，稜全超出期望值，发货速度非常快，包装非常仔细、严实，物流公司服务态度很好，运送速度很快，很满意的一次购物店家很讲信誉，而且很不错哦，在这家店买东东，我很满意。
【10袋】多口味干拌面混合,,20540384845,5,0.9998955963800754,京东买东西质量有保障，快递速度也快，真心感觉不错。家里用的很多东西，还有好多宝宝吃的东西、用的东西都在这上面买，真的感觉很不错。已回购多次，推荐购买。
【10袋】小龙虾口味,,20540328404,5,0.996799441292998,白象大辣娇品牌小龙虾拌面，我第一次买这款拌面，我相信做出来的味道肯定是不错的。外包装盒完好无损，内物完整。好产品值得信赖。
【10袋】多口味干拌面混合,,20251937585,5,0.9855744282463756,泡面很好吃，很多味道都有，但是也有重复的，白象的火鸡面味道都差不多，如果想尝试一下的话可以买一点，面饼没有三养的好吃，但是这个价格已经很实惠了
【5袋】奶油火鸡面,,20311698526,5,0.3367434038136683,"两个版本也做了下对比 ,还是韩国正版的比较好味,但价钱就摆在这裏,还要什么自行车,东西收到以后马上查看，发现与图片描述一致，超级喜欢！"
【10袋】多口味干拌面混合,,20649490615,5,0.9295510376916509,这是一个好评摸板。因为我是很懒的不想每个产品都写好评所以特地写下这个模板，以前不知道~评论可以涨积分，现在才知道好评的重要性妥妥的每条都来评论下，赚积分，下次还能抵现金用。评论80个字以上，可以得到50个积分，我无论买什么东西都会把这个段话复制粘贴下凑够字数。这是第N次在网上买东西了，棒捧棒，东西便宜而且质量好，物美价廉买的放心，用的开心感觉都买上瘾了，买买买，根本停不下来，东西品种多，而且又特别全，划算方便，而且实惠，包装很好，而且没有任何损坏，会一直支持下去的，服务还可以一超级好用，好评，下次再来！
【5袋】椒麻鸡丝口味,,20473754651,5,0.5951520214227582,白象的拌面非常好吃，已经多次购买了。
【10袋】多口味干拌面混合,,20657528301,5,0.7982928753191312,非常好吃，有口感，吃完还是想再买
【30袋】咸蛋黄火鸡面,,20633734290,5,0.9975275577855977,实物与描述的一样，质量相当好，卖家态度也好，有问必答，发货速度杠杠的，值得购买哦
【15袋】多口味干拌面混合,,20514570019,5,0.9210565092327052,很好吃，如果有好评返现就更好了
【10袋】多口味干拌面混合,,20588098185,5,0.9657316575142784,宝贝已经收到了，包装完好，和卖家描述的一样，物流也很快！
【10袋】多口味干拌面混合,,20636875172,5,0.989677826128126,几种口味都很好吃，辣度适中
【30袋】多口味混合,,20519523338,5,0.7428194237492,味道很好，包装很完善，快递运输很快
【10袋】多口味混合,,20200444407,5,0.7951305780398132,真的好吃，味道有很多种
【10袋】多口味干拌面混合,,20405662533,5,0.9040727926886285,非常非常非常好吃，点赞
【10袋】原味火鸡面,,20602578196,5,0.6321943840597493,量比较大，味道也很好
【10袋】原味火鸡面,,20325982524,3,0.7546097272784811,面比较劲道，辣味适中。
【10袋】多口味干拌面混合,,20303289409,4,0.924258219239103,多重口味，非常不错。但是我好几包面饼都碎了
【10袋】原味火鸡面,,20551400310,5,0.9786701360557275,包装完好，没有什么碎的，口味挺好
火鸡面+小龙虾面组合,,20549208725,5,0.9999998727335953,白象火鸡面是一款让人垂涎欲滴的美味佳肴！每一口都充满了浓郁的香料和鸡肉的鲜美味道，汤汁醇厚而清爽，面条Q弹可口。无论是在寒冷的冬日还是温暖的夏日，都能让人感受到满满的幸福和满足。购买时，店员总是热情地提供服务，让人倍感温暖。总之，白象火鸡面绝对是我推荐的一款美食，值得一试！
火鸡面+小龙虾面组合,,20552270767,5,0.9999906805136922,包装精美，看着非常有食欲，味道鲜美，辣味十足，是办公存货必备之选，份量很足，一包足够，值得大家收藏购买，白象品牌值得推荐。
荞麦面20袋+油醋汁,,20582121348,5,0.7450636473575911,第一次买荞麦面，不难吃，这个是方便面，煮一下特别劲道，自己想吃什么加点料，就是一餐美味健康的美食，一箱一箱买，吃完还会回购。
荞麦面20袋+油醋汁,,20619890688,5,0.9999945632958414,饱腹感很强，物流也很快，和方便面很相似，稍微加一点调料，总之非常好，都能和荞麦面完美搭配，减脂期必备主食就是它了，性价比比较高，有方便面的口感，次日达，这个荞麦面条烧完以后没有异味，看着一块小小的面饼，煮出来面还挺多，配料特别的干净，我特别喜欢荞麦面搭配上浓郁的酱油和切碎的姜蒜
韩式火鸡面,,20568831489,5,0.9999565505328671,口味非常不错，特别好吃。之前只买过火鸡面，很过瘾。这次尝尝香菜面和蛋黄拌面。香菜面的面汤非常好喝。嗯，香菜味儿其实没有特别浓。不喜欢香菜的人也可以吃。蛋黄拌面里面有一包火鸡面的面酱。辣的很过瘾。非常好吃。
麻酱面皮10袋,,20588143749,5,0.9999838120709366,在同事的推荐下买了这个面皮，实在是太好吃了，出乎意料，酱料很香，面条有韧性，微辣，挺符合我的口味！健康美味，吃完再买，赞赞赞！
荞麦面20袋+油醋汁,,20598617905,5,0.9992132458337089,白象这款荞麦方便面的配料简单、纯净，采用纯粹的荞麦粉和黑麦粉，钠含量很低，脂肪含量也很低，属于非常健康的食品，非常适合健身人群，食用便捷，口感细腻有嚼劲。使用起来非常方便，只需用开水泡上五分钟，然后加入适量的调料搅拌均匀即可附赠的油醋汁非常好，是减脂时的绝佳调味帮手而且面条的口感绝对不会让人失望，非常有嚼劲。
火鸡面+小龙虾面组合,,20650658094,5,0.9985364240365958,白象方便面口感极佳，汤汁鲜美，面质劲道，美味无限。白象方便面不添加任何多余物质，原汁原味，美味营养健康。白象方便面口感鲜美，香气扑鼻，吃上一口回味无穷。
荞麦面20袋+油醋汁,,20601732244,5,0.9999992002294184,奶味很浓，口感绵软，确实不错的蛋糕。独立小包装，一包分量不大，适合想减脂又嘴馋的时刻。早期配牛奶，咖啡做早餐也合适，能量足够了。包装好，送货快，以后吃完会回购的。
荞麦面20袋+油醋汁,,20585134250,5,0.9999831557156004,白象出品，必属精品！慢碳，饱腹感较强，非油炸，更健康，食用方便，几分钟就泡好了，再也不用操心中午吃什么了。送的油醋汁也不错，物美价廉，好评！祝我早日实现八块腹肌。
麻酱面皮10袋,,20610088430,5,0.9999999992774538,白象面皮，真的是一款让人欲罢不能的美食呢！它的口感超级棒，劲道有弹性，每一口都让人回味无穷。而且，它的味道也是超级赞的，无论是麻辣还是酸辣，都能满足味蕾的不同需求。最重要的是，白象面皮还非常健康，不添加任何防腐剂，吃得放心又安心。总之，白象面皮真的是一款值得推荐的美食，大家一定要尝尝看哦~（眼中闪烁着期待，双手合十，做出一副超好吃的样子）
火鸡面+小龙虾面组合,,20544793507,5,0.2167812832294861,方便面第一次煮的时候用网上的方法吃的，很甜腻的感觉。不太好吃，第二次就直接用的调料拌的，家人觉得很好吃，味道很浓，很香！
火鸡面+小龙虾面组合,,20543614520,5,0.9995047097753501,好吃 挺辣的 适合喜欢辣的宝宝  喜欢吃的宝宝可以购买哦 真的还不错 个人觉得还是经典火鸡面好吃 味道更加好 麻辣小龙虾的带着海鲜味，有点点奇怪 很赞！！！！！！！！！！！！！！！
荞麦面20袋+油醋汁,,20554989826,5,0.9998735209720288,包装卫生干净。在网上购买，性价比也很高，面条很好煮，口感不错，荞麦面和普通的 条口感一样，全面的减肥做代餐吃是很好的呢。
火鸡面+小龙虾面组合,,20581476408,5,0.3076482518567154,前天晚上下的单，昨天白天就到货了，试着尝了一包麻辣小龙虾拌面，面的口感很好，而且这个辣味刚刚好，不会太辣，物流也特别给力
火鸡面+小龙虾面组合,,20555396108,5,0.9982588178911201,两种面都吃了，很给力！之前在超市买的，后来在超市没看到了就在网上买，味道一样，麻辣的，很过瘾！这个酱还可以拌饭，味道也很不错！
火鸡面+小龙虾面组合,,20651765021,5,1.0,这款产品真的太好吃了！我简直无法用言语来形容它的美味。每一口都充满了惊喜，让我欲罢不能。它的口感鲜美，味道浓郁，仿佛将我带入了美食的，都让人陶醉其中。每次品尝都让我感受到幸福的滋味，仿佛所有的烦恼都被瞬间驱散。强烈推荐给大家，绝对物超所值！无论是作为休闲零食还是送礼之选，它都是绝佳的选择。如果你还没有尝试过，那你真的错过了太多！赶快行动起来，让这款美味陪伴你的每一刻吧！
葱油拌面5袋,,20601642030,5,0.9961718533135492,葱油拌面几个字就带着香味，给孩子准备的，小孩子吃次方便面都特别的开心，这个没有辣椒，不用担心孩子吃不了。味道也很美味。推荐。
小龙虾面,,14301543473,3,0.7102427506490302,感觉个人口味没有很好吃
火鸡面+小龙虾面组合,,20565929224,5,0.9610122934050113,非常好吃，白象的小龙虾拌面还有咸蛋黄火鸡面以及火鸡面都很好吃，包装很干净，物流速度很快，还会继续回购这几种的，下次试试别的。
辣牛2+母鸡3+猪骨3+精炖红烧2,,20585605180,5,0.9999969294805823,国民老品牌，好吃又实惠，味道也很不错。开发了多种口味，一次性能唱到各种口味。一个人吃加点蔬菜和鸡蛋就很好。一定要好好加油啊，开发非油炸健康的吧。
辣牛2+母鸡3+猪骨3+精炖红烧2,,20610938123,5,0.9972175018677044,喜欢白象方便面，很多的口味都喜欢，尤其是方便面的汤，非常好喝，面条也筋斗，味道也好吃，还有很多很多的口味可以选择，非常棒！
老母鸡4+猪骨4+精炖红烧2,,20556979293,5,0.9986374563682291,白象方便面的口感非常好。它的面条爽滑有弹性，汤汁浓郁鲜美，让我在每一口中都能感受到真正的美味。尤其是其中的一款招牌口味，更是让我回味无穷。
辣牛2+母鸡3+猪骨3+精炖红烧2,,20612657193,5,0.9997925287764599,白象方便面真的很不错！面条筋道有嚼劲，调料包味道浓郁，煮出来的汤也很好喝。而且，它的价格实惠，性价比非常高。最重要的是，白象是一个非常有社会责任感的企业，让我吃起来也格外放心。会一直支持白象！
猪骨3+辣牛3+金汤2+精炖红烧2,,20612461581,5,0.9998162231686626,老品牌了，还是比较喜欢的，有活动就囤一些，懒得做饭的时候，煮个面，方便快捷，三种口味，任君选择，不错，包装也很好，份量很足
猪骨3+辣牛3+金汤2+精炖红烧2,,20600312435,5,1.0,味道不错，品质不错，价格实惠，物流也很快，好评！趁着活动入手划算，发货快，包装得好，非常不错，全新体验，赞赞赞！特别特别满意，超级好看，客服很有礼貌，很客气，良心商家，支持！特别特别满意，超级好看，客服很有礼貌，很客气，良心商家，支持！五星好评，非常好！想不到那么快就到了！整体来说，还是很好的，非常值得再次回购宝贝真不错，做的真细心，值得拥有，快递很快大品牌！值得信赖！效果超级好！贵有贵的道理！很棒的商品！大品牌！值得信赖！效果超级好！贵有贵的道理！很棒的商品！大品牌！值得信赖！效果超级好！贵有贵的道理！很棒的商品！大品牌！值得信赖！效果超级好！贵有贵的道理！很棒的商品！
辣牛2+母鸡3+猪骨3+精炖红烧2,,20601555931,5,0.9999984474682934,性价比很高，很实惠，使用起来感觉很好，非常完美.^^.质量非常好，完全超出期望值，发货速度非常快，包装非常仔细、严实，很满意的一次购物
老母鸡8袋+精炖红烧2袋,,20600588197,5,0.8885600580170027,面真的很好吃呀，我们全家都喜欢这款白象汤好喝系列。我每次都是煮着吃，面条爽滑劲道，面汤骨汤味浓浓的，很好喝。吃的时候，可以加点白菜，再搞个荷包蛋，营养又美味，那味道简直太好吃了。
