ProductColor,ProductSize,ID,score,sentimentScore,content
番茄牛腩面,,20565501033,5,0.7947987383356084,已经很多次购买这个冻干面了，一如既往的喜欢，比传统泡面好吃多了，采用高汤熬制，真空冷冻技术，最大限度保留色香味，这个番茄牛腩口味非常不错，经常回购啦！
10杯组合,,20635049094,5,0.9999969021736326,东西不错，还有优惠，可以放心省钱购买，不要犹豫了值得购买！没有什么味道，用起来还可以，没有不舒服的地方，所以我还蛮喜欢的宝贝收到了，颜色很好看，质感也很好，样子简单！是我想要的！！下次还会再来！
6杯组合装,,20629622940,5,0.9999517954996227,第一次吃海福盛的产品！非常好吃！竟然也是第一次听这个品牌！落后啦！这个品牌的方便面，是我吃个最好吃的！而且是非油炸方便面，是否比油炸更健康，先不讨论，起码没那么上火！一次买了两个口味！ 这个商品的质量真的很好！外观精美，手感舒适，使用起来非常顺手。卖家的服务态度也很好，让我购物无忧。
藤椒豚骨面,,20657795734,5,0.9998598370163345,东西品质不错，可能会回购。京东快递很快收到货了，一如既往的快，还送货上门，包装的也蛮好。东西也很不错，一直买，好用实惠，回购很多次了。
6杯装,,14786540133,3,0.8124819816790557,感觉还是汤达人好吃点
【随意配搭】15种口味可自选6桶,,20561524963,5,0.9999998724407945,混合口味大面饼物流比较快 泡面也很方便 随车携带很不错 价格也合适小时候的味道 很怀念真的不错哦 性价比高高荐味道搭配的也好推荐推红烧牛肉面
【活动冲量】12味12桶全家福套餐,,20600507626,5,0.9999996621430414,这次在京东上购买了好多零售，放在办公室吃，口感真的非常不错，价格还实惠，口感也很好，很喜欢。每次在京东买东西服务又好，品种齐全，喜欢京东购物，每次都没有让我失望。日期也蛮新鲜很满意.
【经典口味】红烧2+香辣2+鲜虾2,,20545768689,5,0.9969566928815095,康师傅方便面从小吃到大的产品，每款的味道都非常好，京东送货快，方便。方便面包装环保考究，跑出的面就是那么的香，汤味道浓郁，家里老小都喜欢！
【活动冲量】12味12桶全家福套餐,,20565010925,5,0.9995492916834854,康师傅牛肉面，一箱可以解决各种味道的需求，有辣和不辣，大人小孩都喜爱，分量足，刚好够一个人，宵夜来一桶，真的很美味，物流送货快。
【随意配搭】15种口味可自选6桶,,20559938483,5,0.9996623438223954,从小到大都是吃的康师傅泡面，还是那个味道还是那个包装。这家口味非常齐全，后来才发现不同城市能买到的口味是不一样的。一直想念麻辣牛肉味和泡椒牛肉味的，终于在这家店都买到了。物流很快，发货快。套餐很实惠，可以自己备注口味，非常人性化。爱了爱了。
【随意配搭】15种口味可自选6桶,,20651374418,5,0.9965169522060793,买的混合口味 包装比较新 生产日期也是最近的 吃了一些味道还不错陪着火腿肠一起好吃的  希望大家也买点，呢嗯呢性价比很高比较便宜
【店长推荐】12桶12味全家桶套餐,,20548113906,5,0.24118338968026465,"因为喜欢京东，买了京东PLUS会员，常在京东买东西，订单太多，不想每个产品都写好评，所以特地写下这个模板，以前不知道~评论可以涨积分现在才知道好评的重要性，妥妥的每条都来评论下，赚积分，下次还能抵现金用。评论80个字以上，可以得到20个京豆,我无论买什么东西都会把这个段话复制粘贴下凑够宇数。这是第N次在京东买东西了，东西便宜而目质量好，物美价廉，买的放心，用的开心，感觉都买上瘾了买买买根本停不下来，东西品种多而且叉特别全，划算方便，而且实惠，包装很好，而且没有任何损坏，会一直支持下去的，服务还可以一超级好用好评，下次再来。"
【活动冲量】12味12桶全家福套餐,,20562597265,5,0.998258158303066,老配方，老味道，晚上加班的时候吃一桶，感觉非常棒，现在又出了很多新鲜的口味既有老味道又有新感觉。经典的老坛酸菜和酸辣牛肉面是最爱
【店长推荐】12桶12味全家桶套餐,,20583939353,5,0.9999964095431428,泡面很喜欢吃，值得购买，然后买了一整箱是不同口味的，有很多种口味都可以注意教育，有时候早上没有过早的时候吃一点还是挺不错的，然后味道又很好吃，选择也比较多。
【5味12桶】1倍半混合口味大面饼,,20549043413,5,0.8922708978405336,这次活动购买的，价格非常的合适，而且还是大碗的，一碗吃的饱饱的。日期很新鲜，值班时候吃上一碗，美味啊。总体感觉很满意。给力。
【活动冲量】12味12桶全家福套餐,,20588745825,5,0.9955950521932129,12种口味，种类很多，选择也很多，太好了，加班的时候可以有很多口味选，还是加量的，够男生吃，感觉说着说着都心酸了，加班标配。
【店长推荐】12桶12味全家桶套餐,,20612163943,5,0.7440334693203896,每个月都要买方便面，一买都是五六箱，已经买了很多次了，京东的方便面物流很快，包装很好，第一天选，第二天到，非常适合临时加班使用
【经典桶】卤香牛肉*12桶-原箱,,20554008341,5,0.9998990477420142,很好，包装很棒，外观不错，下次再来，到货很迅速这家店的东西很好，发货比较快，物流也很快已经是第五次购买了！质量真的超好！穿上很舒服！同事朋友都叫我帮买！买到就是赚到！
【活动冲量】12味12桶全家福套餐,,20545058525,5,0.9999444645110531,康师傅方便面经典品牌，偶尔就想吃吃康师傅方便面，一箱十二种口味，多种选择，可以随心情选择，哈哈，很好，活动时买价格美丽，送货快，包装好
【店长推荐】6口味混搭6桶-半箱,,20587269055,5,0.999994559691027,康师傅的方便面非常好吃，大品牌值得信赖，孩子非常喜欢在火车上吃，我们经常买。京东的速度非常快，客服的服务非常好，值得信赖，值得推荐你。
【店长推荐】12桶12味全家桶套餐,,20577055364,5,0.9992020477616549,康师傅方便面大家都很熟悉了，不用多说，口味一如既往的好，最常吃的还是&quot;红烧牛肉&quot;，这次买了混合口味，顺便尝尝新口味，希望有惊喜！
【经典】老坛酸菜面 12桶/整箱,,15579344330,3,0.7012457694052093,面饼小一些，便宜一点，可以理解
【1倍半110g面饼】酸辣牛肉*12桶,,20594283830,5,0.9999515888893965,工作加班常备食品，很好吃，买了两箱备着，特别实在，加量不加价，很划算 很实用，很好，很干净，特别好，值得购买，值得推荐，
【活动冲量】12味12桶全家福套餐,,20547290454,5,0.9999995819037013,宝贝特别好，价格实惠，这个价钱能买到这个东西真的很划算，以后还会购买回推荐给朋友。味道很好，包装很好。整体感觉也特别好哈哈
【店长推荐】12桶12味全家桶套餐,,20636884610,5,0.919351726002187,对于我这种不爱做饭的人，简直是太好了，烧开水就可以直接泡泡起来特吃起来特别香人家客服态度又很好，物流又很快价格真的不错，下次还会回购很开心的一次购物
[24袋]红烧+葱香+鲜虾+西红柿,,20564177799,5,0.284680735449202,不错！不错！大包的，一箱里4种口味，可以换这口味的吃，面条也很劲道，生产日期也很新，包装很好没有破损，快递两天左右就送到了。
【24袋整箱装】小鸡炖蘑菇,,20557268975,5,0.9999665078529837,到货速度很快，味道很好，而且刚好是活动价，价格也相当便宜，但是会一下子就到手了24包。很好，而且味道特别浓，很适合日常使用，健康。
【24袋组合装】红烧+葱香+西红柿,,20620545336,5,0.9340609320527723,一直吃今麦郎的方便面，味道很不错，价格也合理，多种口味可以直接联系客服自己选，家里人都不爱吃辣，选的葱香排骨西红柿和小鸡炖蘑菇的，日期新鲜，可以放着慢慢吃。
[24袋]红烧+葱香+鲜虾+西红柿,,20578478802,5,1.0,好吃，收到货，第一时间拆包装，质量非常好，与卖家描述一致，完全超出我的期望值，包装很仔细、严实，总的来说这次是很满意的一次购物，感谢卖家。正品，质量好，价格低，性比价高，物美价廉，物有所值，朋友看了都说好。客服服务热情都到。物流很给力包装很好，快递给力，卖家很有信誉，发货速度也很快。价格更是比别家的实惠多了质量非常好，与卖家描述的完全一致，完全超出期望值，包装非常仔细，很满意的一次购物质量很好，客服态度也特好，会再次光顾的，物流非常快不好意思评价晚了，非常好的店家，东西很喜欢！买来这个是送人的，她很喜欢很热情的卖家，下次还来。质量非常好真出乎我的意料。包装非常仔细。祝生意兴隆刚收到货有点不懂得该怎么使用，咨询了一下客服，没想到客服的人超好，介绍得超仔细的宝贝产品质量很好，是正品。和页面描述写的基本一致，卖家的客服服务态度从头到尾都很好，快递发货速度超快东西收到，很满意！真的是超级好的卖家，解答疑问不厌其烦，细致认真，关键是东西好，而且货物发得超快，包装仔细，值得信赖!产品质量很好，穿着很舒服，颜色款式都不错，朋友都说好看也要我来帮忙买！东西好便宜，质量出乎意料的好，下次还会来的~
【24袋】香辣+重庆+老坛+蘑菇,,20551150172,5,0.9997397567824611,包装完好无损，方便面口感味道好，很好吃很新鲜，这个是真的好，材料和做工都特别精致，我们只吃今麦郎牌子的方便面，久吃不腻，非常好。
【24袋整箱装】西红柿打卤面,,20555546118,5,0.9988490485945906,经典款 非常好吃 适合喜欢来点辣味的你 百吃不厌 这个商品的性能真是令人惊喜！质量上乘，使用起来非常顺手。卖家的服务态度也很好，及时回复我的问题，并解决了我的疑惑。
[24袋组合]红烧+葱香+鲜虾+蘑菇,,20614519603,5,0.99999999948688,这个价格还是很划算的。经济实惠，物美价廉，质量非常好，跟卖家描述的完全一致。非常满意，完全超出期望值，超级划算，性价比高，购物比实体店便宜多了，很满意的一次网购。希望卖家生意越来越兴隆，物流也很快，包装很结实。六星好评，多一星不怕你骄傲，还在犹豫的朋友赶紧下手，良心推荐，真的很不错，性价比也很高，以后还在这家买。给三个好评，满意！满意！满意！
【24袋组合装】红烧+鲜虾+香辣,,20603379574,5,0.9971644043654226,味道还不错，面条劲道，汤也很好喝。面条份量十足，比一般的方便面里的面条，多了一半的份量，对于食量大的人，是一种福音，不用再下一袋了。 卖家的服务真是周到细致！他们不仅耐心解答我的问题，还给予了很多实用的建议。物流速度也很快，让我及时收到了商品。
【5袋尝鲜】红烧牛肉面,,20587683541,5,0.8222180576316291,不要问我怎么样，我也还没吃拿回来就先丢着，虽然看起来挺大包的，京东物流也挺快，看起来应该也挺好吃的，但是好不好也得等我吃了才知道
【24袋整箱装】西红柿打卤面,,20581425187,5,0.9998551339817315,这个口味的西红柿鸡蛋面，味道浓厚，孩子喜欢吃，每天都想吃，大人也喜欢吃，建议入手，毕竟能把味道做这么好的不多，值得购买！
[24袋组合]红烧+葱香+鲜虾+蘑菇,,20643185266,5,0.1609376684805519,第二次购买了，上次买的葱香排骨的，，味道不错，全家都爱吃，这次又复购一箱交叉口味的，4种口味满足我的味蕾。
【24袋整箱装】1袋半火鸡拌面,,20410570750,5,0.9999966429803755,本来点外卖是为了填饱肚子，可是吃了之后真的完全超出想象，吃饭成了一种十足的享受！老板人太实在了，给的份量非常足，味道也是大众口味，性价比超高，以后就是我家的后厨了。包装真的十分用心了，口感、质量、服务一如既往的好，品质绝对对的起这个价。
【24袋整箱装】重庆小面,,20349592427,5,0.9866428564784094,在网上找了好久的重庆小面，终于找到了，下单后没有让人失望，收到货很是惊喜，包装精美，高大上档次，面基本上没有碎太多，物流也很给力，总之很愉快的一次购物体验。
【24袋整箱装】鲜虾鱼板面,,20412135571,5,0.007177210515024179,第二次回购了，今麦郎一袋半量大好吃，一个人一袋吃不完，煮出来吃着很筋道还比超市便宜，快递优秀包裹很严实，没有破损。还会回购。
【24袋整箱装】香辣牛肉汤面,,20399021964,5,0.99999999948688,这个价格还是很划算的。经济实惠，物美价廉，质量非常好，跟卖家描述的完全一致。非常满意，完全超出期望值，超级划算，性价比高，购物比实体店便宜多了，很满意的一次网购。希望卖家生意越来越兴隆，物流也很快，包装很结实。六星好评，多一星不怕你骄傲，还在犹豫的朋友赶紧下手，良心推荐，真的很不错，性价比也很高，以后还在这家买。给三个好评，满意！满意！满意！
【10袋组合装】红烧+重庆,,20406826832,5,0.9999897996704054,方便面，还可以，很方便，很喜欢。好吃，是我喜欢的味道，口感很好，物流也很快方便面，还可以，很方便，很喜欢。好吃，是我喜欢的味道，口感很好，物流也很快！！强烈推荐
【24袋整箱装】葱香排骨面,,19065201947,3,0.17410670897671732,方便面最好不要在网上买，一箱有半箱是碎的
[24袋]红烧+葱香+鲜虾+西红柿,,20433049912,5,0.9999749242409783,以前一直都是在实体店买，这次选择了网上买，不光是正品，价格还实惠！店家发货非常快，服务态度很好，应该是正品，一次很愉快的购物质量非常好，非常满意的一次购物。客服有问必答，非常专业
[24袋组合]红烧+香辣+葱香+老坛,,20335309267,5,0.9999999999992397,一共购入了四个味道的方便面，都快吃完了，才来评价。很不错，价格很实惠，包装很到位。外观设计漂亮，尺寸大小合适，包装仔细完整，宝贝手感不错，感觉很好，发货速度快，服务态度一流，给力！5星好评！ 卖家的服务真是一流！他们把顾客的需求放在首位，耐心解答疑问，并提供了专业的建议。物流速度也很快，让我迅速收到了商品。
【24袋】香辣+重庆+老坛+蘑菇,,20435693342,5,0.999993077574882,经典款 非常好吃 适合喜欢来点辣味的你 百吃不厌 卖家的服务真是贴心周到！他们提供了专业的建议，帮助我选择了合适的商品。物流速度也很快，让我顺利收到了商品。
新大骨面20袋,,20559765375,5,0.98729222230335,很喜欢吃白象的方便面，感觉哪个味道的都好吃，国货大牌子味道很喜欢日期很新鲜发货物流很快喜欢的抓紧时间下单吧，比超市里面的便宜几块钱很好
多半牌24袋红烧牛肉,,20585338046,5,0.9999269610577445,买了好多次，白象方便面，国民品牌，值得信赖，良心企业，值得拥有，面条粗，有劲道，有嚼劲，很好吃，爷爷奶奶都爱吃，一次买了两箱，很不错，贵继续支持！
大骨面5袋,,20602420926,5,0.9995327159132138,商品包装比较精美，物美价廉，使用比较方便，在家里煮放个袋子会更加好吃，味道比较鲜美，分量十足京东快递还是一如既往的好，很快
多半牌24袋红烧牛肉,,20558038606,5,0.9697666421241721,一包的份量很足，够一个人喝的。面饼的口感很劲道，有嚼劲，红烧口味一点儿也不辣，冲出来的汤也很香，吃起来很不错。一直都喝白象方便面。
大骨面5袋,,20568785353,5,0.9997461681305282,国产方便面棒棒哒！！这款是很经典的味道，汤底醇厚浓郁，香味十足，面条筋道，回味无穷，包装也好。在京东有会员买了有优惠，比在超市买的便宜，送货也快，值得推荐！！！
新大骨面20袋,,20613753619,5,0.9991267588984907,很好，货到的很快，京东自营商品的到货速度一如既往地快！白象地大骨面是最经典的一款，味道很不错，面饼也超级大，非常划算！！！以后还会回购！
多半牌24袋红烧牛肉,,20584349026,5,0.6985363497956605,方便面量大好吃，面条有嚼劲，物美价廉，家里生活用品都在京东购买，送货速度快。第一次买这个面，非常满意，面条是粗条，三个料包，菜粉包分离，继续回购！
多半牌24袋红烧牛肉,,20649274027,5,0.9770547852043898,现在方便面只吃白象这个牌子，味道还是相当不错的，我们家小孩也喜欢吃，买这种纸箱包装的性价比就更高了。支持国货，希望白象可以越来越好。
新大骨面20袋,,20584336769,5,0.9817512780773978,非常大的一袋子好吃的，虽然口味不同，但是，种类挺多，真的很不错的！包装，快递，日期，等等，都很满意，感谢卖家，感谢快递小哥了！
多半牌24袋红烧牛肉,,20553827200,5,0.9080164024849439,家里常备一箱，感觉多半袋面饼就是和普通的不一样，面饼更劲道，真的做到了一包吃饱，小朋友也爱吃，再加个流心蛋，几片蔬菜，简直完美。
多半牌5袋红烧牛肉,,20551420407,5,0.8867827626732916,回来煮了两袋子，味道真的很好，和之前吃的味道都不一样 面很劲道是我吃过最好吃的方便面，不愧是白象打大品牌，已经再次回购了两单！
多半牌24袋红烧牛肉,,20601550771,5,0.95691869718365,白象的方便面，一直吃这个牛肉面，面条劲道好吃，自己买点生菜煮一下，搭配起来更好吃，白象的品质还是很棒的，特别喜欢，买了很多次
多半牌24袋红烧牛肉,,20554133142,5,0.9999524024816661,面饼味道很独特，感觉做工上要比其他品牌好，吃着也不腻，没有那么多添加剂，不知道买了多少次白象了，平时早上就爱来一碗热乎乎的面，一如既往支持白象
多半牌24袋红烧牛肉,,20569281411,5,0.755318158839378,之前单独买了5包，儿子跟老公都说很好吃，这次就买了一大箱，一次性吃个够，还给朋友捎了几包，拿到当天就吃了，也说很不错，真的是国货之光。
多半牌24袋红烧牛肉,,20620453371,5,0.2463272143791393,泡面只吃白象的，这款多半袋红烧牛肉面味鲜汤浓，面条劲道，白象作为有担当的国产品牌必须得支持一下，而且京东自营物流配送速度超级快，必须好评！
多半牌24袋红烧牛肉,,20563209489,5,0.998842601031497,家里的白象红烧牛肉面方便面快要吃完了，这次是趁着三月八日女神节，又过来回购的，这款白象方便面分量非常大，味道也很不错，推荐购买
,,1117138914,3,0.9296721560493539,使用效果良好，送货速度快！
多半牌24袋红烧牛肉,,20643758269,5,0.3459668709053064,相信白象，味道可以，干吃面饼很脆，又硬又脆的那种感觉，吃的很爽，泡的话有嚼劲，管饱，面饼很大，稍微小点的碗泡不开，汤的话就是正常红烧牛肉面的味道。
多半牌5袋红烧牛肉,,20609145712,5,0.9999998938611167,我一定会介绍给小伙伴的！经济实惠，物美价廉，质量非常好，非常满意，完全超出期望值，超级划算，性价比高，购物比实体店便宜多了，希望卖家生意越来越兴隆，良心推荐，真的很不错，性价比也很高，以后还在这家买。给个好评，满意！
多半牌5袋红烧牛肉,,20559366389,5,0.46024302593372524,多次购买了，白象方便面好吃，红烧牛肉味道不错，推荐大家购买，京东平台靠谱放心，京东物流配送很快，快递小哥服务态度非常好送货上门。京东自营品质保证。
重庆小面6桶,,20556265380,5,0.0032899588008041825,味道真的比某师傅，某一好很多，真的是一款可以喝汤的方便面!康师傅、统一我从不喝汤，一个不好喝，二来味道不自然，都是调料味!之前买的羊肉味很好！喝了汤后不口渴！
招牌猪骨汤面12桶,,20545696381,5,0.9541383814587308,是很好吃也很好喝的方便面。本来都不知道有白象这个品牌，无意中发现的，没想到那么好吃，看来推送也是有货真价实的好产品的，哈哈，支持国货。
辣牛肉汤面12桶,,20612302506,5,0.09356091521943699,一开始喜欢吃豚骨味的，最近喜欢吃辣牛肉味的，其实不怎么辣，但是味道很好，馋泡面的时候就来一桶，非常方便，京东快递送到门口，推荐大家购买。
辣牛肉汤面24袋,,20555049352,5,0.0007529365710805536,每次吃完了，都会回来再购一箱，放着厨房里。。。工作忙的时候，没时间搞返，泡上一袋或煮上一袋，很方便，又节省时间，主要是他的汤好喝啊。。。。。
辣牛肉汤面24袋,,20618564454,5,0.1794848488569708,这个汤好喝的非常好吃比x师傅的好吃多了，酱料包分量十足的，没有x师傅方便面那股子难闻的气味，已经在京东买了很多次了，发货也快，基本就是隔天到啊，面也很有嚼劲的，全船的人都挺爱吃的
招牌猪骨汤面24袋,,20634648053,5,0.0611600515190156,白象，纯正国产血统。汤好喝，味道好。朋友们多次品尝后，一致好认为，超过那个挂羊头卖狗肉的某师傅太多。本次试吃的是猪骨汤面，冲泡，水煮，都很好，汤鲜，面劲道。
招牌猪骨汤面24袋,,20633531788,5,0.9941966215739663,白象是国民老品牌。煮起来方便。面条爽滑劲道。招牌骨汤的汤底咸鲜美味。口味又很清淡。好吃。无限回购的一款方便面。快递运输很快。面饼没有碎。
招牌猪骨汤面24袋,,20633503069,5,0.9854426537596541,包装精美，物美价廉，食用方便，泡面还是少吃，吃多了觉得有点腻，份量十足，还是不能买一箱一种口味，得换着吃，太多了，一个人吃一种口味一箱，还有这么多。
老母鸡汤面12桶,,20633281995,5,0.999983918042773,一直购买白象方便面，多次回购，真的好吃。又香又纯，信赖白象，信赖京东，发货速度快，产品质量有保障，还会继续回购，特价更优惠。
老母鸡汤面12桶,,20627932292,5,0.07600298721067866,买了好多个品种，多种口味，多种选择，主要买给上夜班的同事吃的，他们都说好吃，买了好多年了！原料新鲜，味道鲜美，面条有劲道
辣牛肉汤面12桶,,20640315571,5,0.9999952922425891,发货速度快，包装完好。白象方便面是国民老品牌值得信赖！面条爽滑劲道，料包真材实料，高汤熬制汤包汤汁浓郁，日常居家必备食品！
辣牛肉汤面24袋,,20633758585,5,0.9995436827656212,白象他们家的面饼相对康师傅、统一来说一直以来就是比较筋道。然后就是他们家的高汤包，取代了粉料包和酱包。然后蔬菜包里面的蔬菜也比较多。
招牌猪骨汤面12桶,,20612246226,5,0.6304044761409494,白象方便面份量充足，面饼有弹性，料也有足够大包，味道浓香，之前买过很多次老母鸡汤面，汤喝起来有很大的鸡汤味道，这次买了款招牌猪骨汤面，但感觉猪骨汤面始终比不上老母鸡汤面浓香，白象中国面，国产好面。
老母鸡汤面24袋,,20620678832,5,0.9997677215023562,白象方便面 大品牌值得信赖 面条劲道爽滑 分量十足 包装结实严密 发货快，物品满意 国货才是超级无敌的 味道鲜美 咸淡适口 会继续购买
招牌猪骨汤面12桶,,20609935822,5,0.9994898998572752,白象方便面还不错，汤包是白象的灵魂，几番试吃，真的没有踩雷的汤包，都是特别实在，汤包很浓稠。白象的面是比较筋道的，煮着比泡着更好吃。一定要掌握好火候，个人经验，水开下面2分钟就可以出锅了，这个时候的口感特别筋道。白象方便面真的很好吃，让我们一起支持国货吧！
招牌猪骨汤面24袋,,20544054480,5,0.010053329319461568,一大箱子如照片这样一包一包的，之前买过老母鸡汤面，辣牛肉汤面，辣牛肉汤面有比较大的辣味，这个猪骨汤就没有了。面好吃，汤包味很浓，一包方便面下一包汤料也够了，剩下的汤料可以留着以后煮其他面条，也很好吃，白象方便面，可以说是国货的良心企业了。包装完好没损伤。口感真的是一级棒，面条很劲道，汤就更是一绝，超级超级好喝。所有白象的口味我都吃过，吃白象方便面不喝汤，等于没真正认识什么是中国的白象！
招牌猪骨汤面,,15029476741,3,0.40414825406538457,个人口味，不代表全部哈
