ProductColor,ProductSize,ID,score,sentimentScore,content
N3白【MATX/240水冷位】,,20004271603,5,0.9858332708815982,内部空间：还算宽敞，一个sata固态，一个机械硬盘做工质量：铁皮还算厚实，喜欢这种电源放在前面的造型散热效果：散热很好，上下对流散热。前机箱只有一个开关机按钮，简洁
W5白色/ATX/8风扇位,,20336844068,5,0.9900906104784992,下单的第二天就到了，物流速度快，包装结实，这款机箱做工很精致，第一次买白色机箱，颜值很高，内部空间大，附带的螺丝配件齐全，性价比高。
烈焰Z黑色/ATX/RGB灯条,,20352598282,5,0.9994681496228598,发货快，包装严实，商品质量非常好，比专柜便宜很多，客服服务态度也特别好，好评非常满意，材质做工非常好，而且百搭，手感也很棒，非常nice，实用性非常强，赞
风度黑色/ATX/玻璃侧透,,20169170252,5,0.9980699750538179,外观，时尚大气，具有流行风格，铁框加钢化玻璃。设计，符合大多数装机用户的需求，预留的背线走位，开孔，风道设计，水冷安装位置等等，都是一流的用料，扎实，不会摇摇晃晃。
W5黑色/ATX/8风扇位,,20242305739,5,0.5387321235775218,这次换电脑，买了这牌子的机箱试试，因为买的家用日常使用不打游戏的配置，这个机箱实际使用率不高，好在里面够大，顺便解决散热问题了
W5黑【ATX/玻璃侧透】,,20108088855,5,0.7193430464898994,这是一个好评模版，京东买的所有产品都可以进行好评，只要有50个字就可以额外获得20个京豆，以前不知道这个事情，现在知道了，每个购物后都会给好评，谢谢。
W5白色/ATX/8风扇位,,20469198347,5,0.5750804593261554,机箱大气漂亮，结构合理，加强筋作用使得薄铁皮做的机箱很牢固。小机箱可以放大板。
烈焰Z黑色/ATX/RGB灯条,,20570544914,5,0.9990170578645449,性价比高！质量嗷嗷的 一次点亮，大品牌值得信赖
N3白色/MATX/240水冷,,20182400927,5,0.2924669277375863,机箱非常漂亮，侧板透明的也挺好的。
W5白色/ATX/8风扇位,,20510680756,5,0.9707917950729936,外形外观：漂亮，客服态度回复很快。
W5黑【ATX/玻璃侧透】,,20130025960,5,0.9911357740766701,很不错的机箱很厚实，性价比也很高
W5黑色/ATX/8风扇位,,20358339404,5,0.4218724671297106,非常好用的atx机箱，值得推荐非常
W5白【ATX/玻璃侧透】,,20086757307,5,0.9923585645298216,非常棒的产品价格也很合适
W5白色/ATX/8风扇位,,20308853348,5,0.9378981789005221,京东自营品质保障，速度快，质量好，一次点亮
W5黑色/ATX/8风扇位,,20427208359,5,0.04642449851555419,机箱很不错，大小和质感都符合我的预期，就是店家少发了个底部风扇长螺丝，不过给补发了.
烈焰Z黑色/ATX/RGB灯条,,20390387951,5,0.762102413553399,已多次购买了，给公司装了多台了，很好，但怎么这次还涨价了，唉～
鬼武者5/ATX/玻璃侧透,,14226388010,3,0.9913317998786974,外形外观：确定是这是新的？
本色K13【形美器利 8风扇位】,,20611551698,5,0.9933815816820639,长城是老品牌了，坚持踏实做产品，本来试试看，毕竟这么便宜，到货发现机箱还真不错，虽然便宜，但是做工用料一点也不差，装机完看起来真不错，所有功能正常，完美无瑕疵，高兴
铁幕H503B【360水冷 4090显卡】,,20658153377,5,0.999787803055539,外观看着高大上，黑化神秘感十足。，内部空间大，显卡按进去绰绰有余。散热效果好，安装简单，重量足。支持背线，电源下沉。硬盘位置多，可扩展性好。
马里亚纳【360水冷位 E-ATX】,,20652287637,5,0.9989319652849059,内部空间：超大做工质量：很不错散热效果：两面还是三面有散热孔外形外观：还不错产品包装：包装还OK，保护措施也到位，没有发现磕碰什么的。这个机箱的尺寸是我万万没想到的，居然那么大，看图片还以为是我想象中那种尺寸，结果超级大，哈哈，给仓库买的，估计他们也会觉得太大了。
本色K13【玻璃侧透 支持4080】,,20684485016,5,0.8360768679427191,机箱还可以，挺不错的，非常好，希望能用很久不会坏，过这天还会过来购买，还要加人，很多主机需要现金，，外观很好，买了几个，有些变性了。
阿基米德9W【360水冷 4090显卡】,,20646909322,5,0.9999999881106275,内部空间：挺大的，还以为放不下，没想到可以。做工质量：做工很不错，给公司买的，这外观，看得我都想买台回家。散热效果：散热效果还可以。外形外观：外观挺漂亮的，白色、透明。产品包装：包装挺安全严实的。
冰霜X3【360水冷位 磁吸翻门】,,20658473829,5,0.9970566144858727,长城的机箱一直就不错，内部空间较大，安装的时候比较方便，散热做的很好，外形很酷，且留了多个风扇安装位u，是搭海景房的理想机箱。而且价格也比较实惠。推荐推荐
本色K13【形美器利 8风扇位】,,20616683433,5,0.9982995548434835,新款K13机箱，采用玻璃侧透面板，时尚，大气。做工扎实，用料厚实，内部空间大，布局合理，散热空间。发货速度快。经济实惠的好机箱。
本色K13【形美器利 8风扇位】,,20620242030,5,0.999999999969071,机箱外观：外观设计简洁大方内部空间：内部空间充足，装机过程很流畅，不卡顿做工质量：做工很好，钢板不是用的很薄的那种，长城不愧是大品牌散热效果：风道合理，散热效果很不错！
阿基米德9W【360水冷 4090显卡】,,20600252690,5,0.999994320149366,机箱外观很漂亮，简约，很大气，很好看，看起来很结实，颜色也很正，很有质感，内部设计也相当合理，走线很方便，配件非常齐全。
本色K13【形美器利 8风扇位】,,20604980086,5,0.9997609939746547,长城新款K13机箱，玻璃侧透面板，更时尚，更大气。做工扎实，用料考究，内部空间大，布局合理，散热空间大，效果好。发货速度快。
本色K13【玻璃侧透 支持4080】,,20696558741,5,0.9991620409543069,内部空间：空间非常大，玻璃盖板，从外面看非常高大上做工质量：做工非常好，快递包装的也很好。散热效果：散热无敌，散热孔也比较多，可以配8个风扇外形外观：真的是帅，太好看了
本色K13【玻璃侧透 支持4080】,,20686510117,5,0.3812471088221183,之前的电脑就是用的长城的电源和机箱，非常好，五六年没一点问题。宝贝质量很好，收到货第一时间打开看了，很不错，很满意，客服也有问必答，感谢
本色K13【形美器利 8风扇位】,,20651342889,5,0.9999994285564154,内部空间：空间确实很大，支持各类型的主板做工质量：这是帮朋友买的第三个了，价格实惠，实用散热效果：空间大散热效果肯定没问题外形外观：外形简单大气，上档次，产品包装：包装每家不都一样，如果朋友再让我帮他们配电脑，我还会买这款
阿基米德1白【超宽体 玻璃翻门】,,20603076620,5,0.9992716598792462,产品非常好，商品介绍清晰，按需选择，价格便宜性价比非常高，多次购买，使用性能稳定，国产好货，一点不落合资品牌，支持国产商家，振兴中华!
本色K13【玻璃侧透 支持4080】,,20692319820,5,0.2759333313335516,公司配电脑，有个老主板是ATX的，只能买大机箱的！看了看长城这款价格也算最便宜的（电源下置的）收到货整体来说还不错的，板材也算很薄！京东自营送货速度，五星好评
阿基米德9【360水冷 4090显卡】,,20696433408,5,0.9999999999711642,质量很好，做工精细，满意宝贝做工真的非常精细，细节真的棒，爱了爱了网心仪已久，果断下手，用过之后感觉很不错，是正品，快递也很给力，果然名副其实看大品牌，用起来很放心，质量非常好，赶上活动购买非常的划算当时买的时候还在犹豫价格，买来之后一点都不后悔，而且物流还快，可以入手当时买的时候还在犹豫价格，买来之后一点都不后悔，而且物流还快，可以入手
阿基米德KM1白【宽体 适配30系】,,17017089998,3,0.4803266887295041,这个还不错，装说冷方便
本色K13【形美器利 8风扇位】,,20598579078,5,0.8806624201535369,机箱挺不错的，到货包装很好，没有损坏，装机一切正常，活动价性价比对比其他品牌还是比较高的，玻璃很厚实，铁皮不薄，这款支持ATX大板。买过四个长城机箱，都还可以。京东快递第二天就送货上门，点赞。
,,20648149811,5,0.9636027533958226,机箱尺寸合适，组装方便，散热风道布局合理，独立的硬盘仓和主板分离 更加有助于散热和规划布局 对强迫症太友好了 物美价廉，五星好评！
本色K13【形美器利 8风扇位】,,20620788906,5,1.0,机箱评价语1.内部空间：很不错，三个3.5硬盘都放下了做工质量：非常好，玻璃侧板尤其厚实散热效果：太赞了！比之前的机箱降低了10度外形外观：设计酷炫，前置风扇有RGB等效2.内部空间：非常大，我的主板刚好够放做工质量：质感一流，很结实散热效果：风扇够多，还静音外形外观：测玻璃搭配风扇灯效，效果很nice！3.内部空间：空间足够大，设计也很合理做工质量：磨砂金属材质，摸起来就很有质感散热效果：比之前的机箱散热效果好多了外形外观：RGB等效可以神光同步与主板完美匹配4.内部空间：空间够大，以后升级也很方便，尤其是显卡预留位置，能满足所有显卡做工质量：用料很扎实，带侧开玻璃门，很厚重散热效果：散热非常好，上排还可以预装360的水冷外形外观：侧边玻璃门很通透可以展现出RGB灯光效果5.内部空间：空间比较大，不愧是全塔机箱，走线比较富足有很多空间做工质量：板材很厚实，非常完美散热效果：12个风扇位，散热效果非常好外形外观：机箱颜色很耐看，侧透玻璃也很美观。15
S5MAX白色机箱,,20695854123,5,0.9999997817814262,我不是托，买了三次了、质量非常好，与卖家描述一致.孩子们都特别喜欢吃，版型很好，面料舒适，尺码标准.不沾杯持妆久，橘色系更加显白，洗完也很柔顺头发也不油了，屏幕清晰运行流畅，敏感肌用起来毫无压力，握感舒适不伤牙龈，每次炒菜都会放几滴，用起来和真人差不多，很舒服。很满意的一次购物
S5MAX白色机箱,,20687298161,5,0.9990173138415468,内部空间：充分利用每一个空间，支持matx和itx做工质量：用料不错，重量和质感很好，固定每个器件牢固散热效果：机箱每一侧都有孔，支持装散热器外形外观：白色机箱很好看
S5MAX黑色机箱,,20612373117,5,0.999999999992947,作为一名消费者，我非常高兴能分享我的使用体验。我最近购买了这款不错的机箱，给我留下了深刻的印象。首先，我想说的是，这款机箱的性价比真的非常高。在市场上，很难找到既有颜值又实用的机箱，而这款机箱恰恰做到了这一点。它不仅外观时尚，而且价格实惠，让我觉得非常满意。其次，这款机箱的质量也非常好。它采用了高品质的材料制造，结构坚固，能够有效保护内部硬件。在使用过程中，我发现它能够很好地承受各种环境条件，让我可以安心使用。最后，我想说的是，这款机箱的安装非常方便。它设计合理，结构紧凑，使得整个安装过程变得非常简单。即使是新手，也能够轻松完成安装。总的来说，我对这款机箱非常满意。它不仅具有出色的性能和颜值，而且价格实惠，非常值得购买。我强烈推荐给那些正在寻找一款性价比高、实用且颜值高的机箱的消费者。
S5MAX黑色机箱,,20596716769,5,0.006087774049019612,小巧实用的机箱，可以装itx和M主板，侧面是玻璃的不是塑料板这个要好评，耐磨清晰不错。顶、正面都是孔，可以很好的透气，装水冷也可以。
S5MAX白色机箱,,20687618945,5,0.001266277412306116,鱼巢S5MAX电脑机箱小巧玲珑，质量不错，手提式机箱非常方便还没有配上电源，等电源买回来自己动手安装，大小真的是非常合适，透明侧板安装后必须好看。
S5MAX黑色机箱,,20670213859,5,0.9996951677272979,质量非常好，已经是多次购买了，运输速度很快，送货上门很方便，京东物流仓储没话说。下次还会继续购买，很不错。质量非常稳定，这点很放心。
S5MAX白色机箱,,20673189300,5,0.9895016891116839,好评，虽然机箱铁皮厚度不是很厚，但是上下前后面板都是网孔，散热应该很不错，体积又非常小，普通配置散热足够了，主要优势就是不占地方。
S5MAX白色机箱,,20694140382,5,0.9999819121672926,有一说一颜值这块确实不错，做工方便偶尔会出现玻璃孔对不上的问题，整体做工算不上差也说不上来多好，中规中矩，搭配手提携带方便。
S5MAX白色机箱,,20655370480,5,1.8732591633430218e-07,白色机箱意外的好看，支持MTX主板这点挺好，箱子大小刚合适，内部空间管理还是比较好的，老电脑升级过来的，用了原来机箱里的2个3.5机械、1个2.5 SSD、3个风扇，都塞进去了，装的时候电源架子有点不太好装，因为用的老电源，勉强装进去，整体铁皮有点薄，不过这价格还要什么自行车，推荐购买
S5MAX黑色机箱,,20652958473,5,0.9996560478721697,不错 特地用几天才来评价的 ，  经过这几天的使用 东西不错，值得购买做工质量：一般内部空间：合适大小刚好产品包装：不错
S5MAX白色机箱,,20521856439,5,0.878946347575001,这个真的太了，包装很精美，宝贝做工比较精细，商家特别好，有问题都及时处理，确实是一次相当满意的网购，还会再来的
S5MAX白色机箱,,20521849611,5,0.9998801354559749,赶上做活动的时候买的，这个价格一分钱一分货，从外观看很美，材质做工都不错，感觉买值了，还有物流超级快，点赞！
S5MAX黑色机箱,,20590817078,5,0.9999999808797618,内部空间：内部空间足够安装matx的主板。做工质量：机箱做工质量很好用料很扎实。散热效果：整体散热没有问题还带有放尘网。外形外观：外形小巧，适合放在家里小空间位。产品包装：产品来的时候包装很给力完好无损。
白色机箱+爱国者500W电源+3个白光风扇,,20380550864,5,0.9971358571967469,还没装完，机箱很漂亮，容积也不错，虽然紧凑，但是兼容性不错，客服的态度好，耐心解答安装的问题，点赞。
S5MAX白色机箱,,20382419892,5,0.986271542583576,内部空间：matx基本都可以放得下，空问还是充足的。做工质量：铁皮箱子，电源架有点粗糙，好在看不见可以接受。总体性价比很高。外形外观：喜欢外观才入手的，但前面板和上部开洞能看到里面的线，带的防尘网不太遮得住，所以自己再加了层
S5MAX白色机箱,,20492553580,5,0.9999999651313608,内部空间：紧紧凑凑可以做工质量：薄薄一层铁皮不过为了轻便还可以散热效果：四面八方都是洞散热没的说外形外观：长方体火柴盒，上面可以带把产品包装：外观整洁好看，有种简约美哈哈哈
S5MAX白色机箱,,20618334751,3,0.013077032144001688,质量一般，装上后有共振，以前的机箱没有
白色机箱+3个白光风扇,,20452422121,5,0.0001572105005497315,一直想装台小主机，这次看到鱼巢S5就马上行动了，符合预期，配件都装进去了，小机箱 空间却不小，还能装一对音箱
黑色机箱+3个白光风扇,,20440077400,5,0.9999999522825808,内部空间：内部空间很不错做工质量：做工质量非常不错散热效果：散热效果不错，孔板散热不错，也有防尘网不担心进灰外形外观：外观非常不错，加风扇完美，更漂亮产品包装：产品包装非常不错，包装的很严实
黑色机箱+3个白光风扇,,20438674966,5,0.9999806708850386,比我想象中要好，机箱比较精致，用料还可以，性价比很高，有机会会再次购买其他产品，快递也不错，综合来看是一次不错的购物体验！
超越3单机箱,黑色,20516221048,5,0.999942472727553,价格实惠，满足使用，大小合适，物流很快！按键段落清晰！前面有防尘就更加好了！价格实惠，满足使用，大小合适，物流很快！按键段落清晰！前面有防尘就更加好了！
超越3单机箱,黑色,20550435101,5,0.5716150675611911,机箱做工很好，质量不错，颜值也很好。就是对于大显卡来说有点偏小，装小显卡的还行，显卡大了之后下面的SATA接口都没有空间了，太紧凑了
超越3单机箱,支持顶置240/全景侧透,20313000814,5,0.9979090390988213,收到货很满意，外壳没有变形  ，风道 很好散热  而且价格也很优惠 ，  不错！ 这个商品的质量非常可靠！经过使用测试，它表现出色，没有出现任何问题。卖家的服务态度也很好，给予了及时的售后支持。
超越3单机箱,支持顶置240/全景侧透,19996719824,5,0.9994086730010189,包装送来完好无损，自己组装的电脑，很成功，运行流畅。原来的电脑玩游戏带不起来了，奖励自己新买一台。价格合理，各方面还算比较满意。
BU420（显卡限长30厘米）,黑色,20543560686,5,0.9504608765370277,内部空间：空间够了  matx做工质量：还行  过得去散热效果：一般吧产品包装：包装还是挺严实的
超越3单机箱,黑色,20660998287,5,0.8872602759706636,内部空间：很大做工质量：还可以！散热效果：前3上2下1风扇位！外形外观：小机箱产品包装：很普通
机箱+新月RGB风扇*3,支持顶置240/全景侧透,20352426350,5,0.9996315548432122,挺好的 外观各种都比较好 能够适配各类需求 目前来说很满意
超越3单机箱,支持顶置240/全景侧透,20311393658,5,0.9951623933927093,散热很好，外观也不错
机箱+新月RGB风扇*3,支持顶置240/全景侧透,20270346433,5,0.7594028701696337,用了一段时间了，很好，完全没噪音。
超越3单机箱,支持顶置240/全景侧透,20256528357,5,0.954901231737716,没做预算买机箱风扇，中规中矩挺好的
BU420（显卡限长30厘米/散热限高160mm）,黑色,20690698831,5,0.07328495153898396,机箱设计很合理啊，钣金0.5厚度还可以，不算太薄，跳线的地方线材不错
BU420+流星RGB工包风扇*3,黑色,20638344036,5,0.9999355244106017,还可以吧，中规中矩，价廉物美，如果四角做圆润一点就完美了
超越3单机箱,支持顶置240/全景侧透,20253180692,5,0.14932897198242423,散热风扇位挺多，可以支持上240水冷
超越3单机箱,支持顶置240/全景侧透,20260997274,5,0.76070373235008,机箱还不错，这个价位能用就行。
超越3单机箱,黑色,20474814304,5,0.8554976435858522,用着还行，用着还行，
超越3单机箱,支持顶置240/全景侧透,19232560683,5,0.0009370415397133014,好评，非常稳重，钢板够厚。没对比就没伤害。一开始买了某t的atx机箱，设计不合理，整个机箱的重量比航嘉这个matx的机箱还轻。发货很快。百元机箱无敌。
超越3单机箱,黑色,18869386788,5,0.10856484070072092,看不出来这个小箱子还挺能装的哈，大显卡也能装进去，完全没有压力，装小板，这个箱子还是挺不错的，体积小也适合搬动，因为是公司办公用电脑，已经非常满意了
超越3单机箱,支持顶置240/全景侧透,19795633885,5,0.9992573616645369,内部空间：空间挺大，合格的正常mtx机箱做工质量：做工很厚实，是我百元以下用过最好的外形外观：很好，不土产品包装：厚实，里面填充到位还送了很多适配的螺丝和扎带
超越3单机箱,黑色,18867910845,5,0.9997312767608295,内部空间：挺大的做工质量：非常棒散热效果：风道设计的挺好的，温度一直都挺正常的外形外观：简约又好看，正面的防尘网设计能看到风扇灯。产品包装：包装的很严实，商品送过来完好无损
超越3单机箱,黑色（可顶置240/7风扇位）,18397531438,3,0.1260109771056449,参数4个硬盘位实际只能装俩硬盘
新品上市/JV13黑/MATX/RGB灯条,,20696021264,5,0.9339750867461665,机型大小用来装微星b760、七彩虹4060、双塔散热，尺寸刚好合适，没有太多浪费空间，质量也很好，顶部的网片可以单独取下来清洗灰尘，非常有人性化设计。
新品上市/JV13白/MATX/RGB灯条,,20616950728,5,0.9499901210380088,这机箱还挺好看理线空间也大，挺不错，白色质感也很好，玻璃做了黑化，非常的帅气，会再次回购的一款机箱，兼容性也不错，没啥太大的槽点。
A15/ATX/左侧透,,20608854719,5,0.9617957350804794,爱国者的机箱，质量很好，做工很精细，价格也很实惠，布局合理，搭配爱国者电源刚刚好，京东物流也非常的给力，第一天下单第二天就送达。
M2钛灰/M-ATX/240水冷,,20660900214,5,0.24906455368503688,内部空间：非常不错！选了好几个，这个最好看，内部空间也大，非常满意做工质量：质量非常好，唯一缺点就是线竟然不是屏蔽的，20多块钱的都是屏蔽的！
A15/ATX/左侧透,,20655459977,5,0.9999975778286366,好!!不错，款式挺满意的，挺喜欢的，发货速度非常快，包装非常仔细、严实，物流公司服务态度很好，运送速度很快，很满意的一次购物。
A15/ATX/左侧透,,20656393276,5,0.21252717885049688,包装的超级严实，验货时没有一点问题，特地等了几天以后才安装好，安装好用了一周了，打好几个游戏非常舒服，
新品上市/JV13白/MATX/RGB灯条,,20640459763,5,0.9748069186927475,电脑机箱非常好，做工精致，大小合适，有氛围灯，可以调多钟颜色，重启键和灯光控制二选一内部空间：MATX主板的大小外形外观：非常好看，白色的产品包装：很好，回来一点磕碰没有
新品上市/JV13黑/MATX/RGB灯条,,20676740235,5,0.14073179657418444,机箱不错，做工扎实，可以支持MATX主板、最长350mm的显卡、最高160mm的CPU散热器，对于大部分主流的散热器和显卡来说，它都是可以轻松安装的。 M2的钢化玻璃侧板设计的，非常有意思，机箱的底部带有一个抽拉式的防尘网。支持顶置12cm*2、前置12*2和后置12*1的散热风扇，相当大气。
新品上市/JV13白/MATX/RGB灯条,,20639886977,5,0.9998171100652878,内部空间：非常适配做工质量：质量很好，玻璃比较厚，是很硬的散热效果：散热效果很好外形外观：这个外观是非常上档次的，内置一目了然产品包装：快递非常的快，包装非常严实，里面的泡沫很安全
新品上市/A15白色/左侧透,,20676544486,5,0.9983544950377109,颜值是自己喜欢的类型，白白的，看着很干净。做工很好，边角处处理得很顺滑，质感蛮不错。透明的机箱，里面的配料清晰可见，感觉非常好。
新品上市/JV13黑/MATX/RGB灯条,,20669292465,5,0.9037676453774783,很不错的机箱，外观简约大气，内部结构合理，机箱上边的灯条可以切换不同的模式，虽然占用了重启键的功能，不过都是可选的。满意的一次购物。
新品上市/JV13白/MATX/RGB灯条,,20699334681,5,0.307758290084278,爱国者这个机箱，颜值在线。整体结构设计没有明显的瑕疵，前面板的灯光颇有&ldquo;画龙点睛&rdquo;的妙处，十分&ldquo;亮眼&rdquo;。京东物流效率十分给力
新品上市/JV13黑/MATX/RGB灯条,,20629021595,5,0.098071924789778,机箱很简约，安装简单，感觉百元机首先且无对手，还有rgb灯条，属实很良心，快递很快就到了，昨晚上买的，今天就到了，很好看！
A15/ATX/左侧透,,20700727215,5,0.9916826056669508,宝贝收到了！实物和图片是一致的！质量 和质感都挺不错的呢！很满意！喜欢喜欢！商家服务态度也很好！问问题 回复解答也挺快的！发货速度也不慢！很满意的一次网购消费！
新品上市/JV13黑/MATX/RGB灯条,,20701006470,5,0.9996209663340502,作为一个消费者，我非常高兴有机会评价这款机箱。在使用过程中，我发现这款机箱有许多值得称赞的地方。首先，这款机箱的设计非常人性化。它采用了宽敞的结构，使得安装硬件变得非常方便。同时，它的散热性能也相当出色，能够有效地帮助保持电脑的稳定运行。其次，这款机箱的材质非常坚固，给人一种非常可靠的感觉。它能够承受一定的压力和冲击，这对于那些经常需要移动电脑的用户来说非常重要。
新品上市/JV13黑/MATX/RGB灯条,,20699212886,5,0.026784402579534405,第一次买这种小机箱，之前用的都是很大的，不过这种小的可以放在桌面上，很方便，不用担心孩子乱摸，装里面的零件也都很实用，电脑装好了用着顺手
