ProductColor,ProductSize,ID,score,sentimentScore,content
【轻食代餐】魔芋面220g*6包,,20653027925,5,0.8056730515863099,很好吃的，非常不错，送货也快，第二天就收到了。做法简单方便，自己可以少加点配菜。热量也是非常低的，作为减脂期的食物，解馋～就是量少。
【轻食代餐】魔芋面220g*6包,,20613019506,5,0.5769357289824704,客服服务态度很好，快递也不赖，希望老板生意越来越好！！！商品收到了，包装得很好，物流非常快，客服态度很积极，有问题及时解答！总体来说非常满意！
【轻食代餐】魔芋面220g*6包,,20578185260,5,0.7453946489359443,第一次买这种面，价格还可以，打开即食，不用泡开水，很贴心，量也还可以，一箱三个口味，一共六袋，临时路上充饥挺好，热量也不高。
【轻食代餐】魔芋面220g*6包,,20655067388,5,0.6777897409612751,这个牌子的魔芋非常好吃 也不担心添加了糖和别的一些高科技狠活。肚子饿的时候可以放开着吃，口感非常想毛肚，下次还会复购的。
【轻食代餐】魔芋面220g*6包,,20658625038,5,0.9999726775549143,挑选了很多款，这个味道感觉最好。减肥时候食用，感觉效果不错。包装也比较整洁。京东的快递是最方便的地方了，好评。减肥的人群可以尝试下。
【0脂轻卡】魔芋凉皮275*4包,,20609875983,5,0.9970604375942634,配送速度很快，隔天就收到了包装很好，没有破损，质量很好口味不错，物美价廉，下次还会再来。客服态度很好，很耐心的解答了我的问题，产品质量很好
【轻卡饱腹】麻酱爆肚245g*4包,,20649293874,5,0.9999708000212663,这个凉皮QQ弹弹的 第一次做还挺好吃的呀 包装也还不错 饱腹感挺强的 很适合减肥期间 瘦掉5斤啦 超级超级开心哈 推荐大家减肥期间可以食用 我觉得我做的还行 哈哈
【轻食代餐】魔芋面220g*6包,,20625008474,5,0.36680620388100504,商品送来的速度非常快，购买后第二天就送到了，包装方面也没有破损，非常安心顺心的购物体验，至于产品的味道，只能等以后尝过了才知道。
【0脂轻卡】魔芋凉皮275g*4包,,17342133314,3,0.3769278003502182,还行吧，味道一般，不会再买了
【轻食代餐】魔芋面220g*6包,,20609305240,5,0.9999992191037962,质量没得说，跟专卖店一样，特别特别喜欢，而且价格优惠很满意，做工很好，物流快，客服很棒，点赞货真价实，高颜值，高品质，一分钱一分货，材质外观和质量一看就很上档次，非常喜欢
【劲爽乐24袋】红烧12+排骨12,,20564441565,5,0.9861785768926002,一直在这家买，商家服务很好，发货快，包装完好，物美价廉，值得购买，给店家好评，同时一如既往的支持京东！
【活动冲量】9味24袋全家福组合,,20549660772,5,0.1422489338342824,首先说咱们客服服务态度很好，快递员打电话送货也很及时到位。泡面也主要是偶尔泡着吃一下，味道挺好的，种类也挺丰富，感谢商家喽。。。
【劲爽乐24袋】红烧12+排骨12,,20543812989,5,0.9999245833808484,从小就喜欢吃康师傅家的方便面，后来出了这就款劲爽拉面后就独爱了，吃起来真的很筋道，劲爽，口味一如既往的香，而且我这次买的是红烧和排骨两种口味的，太好吃了
【3味24袋】红烧8+香辣8+酸菜8,,20646674284,5,0.9999918035076668,这次终于选对劲爽了，劲爽的比劲爽乐克数要多一点，很喜欢红烧牛肉面，有多味道组合可以试试不同口味也不错，真的好香，吃完还会回购的
【劲爽乐】红烧8+香辣8+排骨8,,20609679332,5,0.9825114989061507,OMG在京东已经疯狂购物了，真的，京东不仅速度快，服务态度好，就连物品包装都是完好无缺的，没有发现泡面有碎的，太棒了
【劲爽乐24袋】红烧12+排骨12,,20654874732,5,0.01284139864101097,面饼70克，对于饭量大的我，吃两袋够用，葱香排骨面是我喜欢的方便面，别的味道我接受不了，买了一箱，1.4元一袋，感觉很便宜，准备去日本旅游时带几袋。
【4味24袋】香辣+酸辣+藤椒+爆椒,,20579026116,5,0.05443225662461282,很喜欢吃这个口味儿的方便面，我一次买了两箱子的，一箱子里有24包。一箱子里有红烧牛肉面，一箱子里有各种辣味的。吃完了再来买吧
【活动冲量】9味24袋全家福组合,,20571302581,5,0.9971777478639368,泡面很好哦，看到百亿补贴有，就立马下单了，而且口味多样，九个口味，不会很单一，口味多吃的不会腻，一箱24包很实惠，很适合上班族和学生党，特别是像是我这种午休时间短的学生党，泡面还是拉面款的，值得一试
【劲爽乐24袋】红烧12+排骨12,,20641248985,5,0.9999194696422266,这个方便面有两种口味儿，都挺好吃的。 已经吃了好几袋儿了，才来评价的。快递特别好。 很快东西的质量也很好。 还会回购的，不错不错
【劲爽乐】红烧8+香辣8+排骨8,,20635519090,5,0.9671958717941169,"因为喜欢京东，常在京东买东西，订单太多，不想每个产品都写好评，所以特地写下这个模板，以前不知道~评论可以涨积分，现在才知道好评的重要性，妥妥的每条都来评论下，赚积分，下次还能抵现金用。评论80个字以上，可以得到20个京豆，我无论买什么东西都会把这个段活复制粘贴下凑够宇数。这是第N次在京东买东西了，东西便宜而且质量好,物美价康，买的放心，用的开心，感觉都买上瘾了买买买根本停不下来，东西品种多而且又特别全，划算方便，而且实惠，包装很好，而且没有任何损坏，快递小哥也很热心，会一直支持。小巧，黑色的效果再试一下看看，然后追评。"
【活动冲量】9味24袋全家福组合,,20573224996,5,0.3168591087965382,都第三次购买了，真的很实惠，1.5元一袋，晚上下班饿了可以回来把自己犒劳一下，商店一袋现在都三元了，量也很足，一袋就能吃饱
【3味24袋】红烧8+酸菜8+西红8,,20594614050,5,0.3272013039576285,货比三家，不只是三家，京东活动最实惠，物价飞涨的年代，真的太难了，衣食住行真的是货比三家，希望京东多多搞活动，让我们消费者得到实惠，提高大家生活幸福感。薄利多销嘛，你们企业少挣点哈哈哈哈哈已经吃了不少了
【活动冲量】9味24袋全家福组合,,20592090137,5,0.9999999872311757,第二次购买了，藤椒味儿的绝了啊，真的淡淡的香，辣，真的很好吃，最爱藤椒味儿的，还便宜，还实惠，吃面认准康师傅，而且还是京东平台，更加信任。 这个商品超出了我的期待！不仅质量上乘，而且功能齐全，性价比很高。卖家的服务态度也非常好，让我有了愉快的购物体验。
【劲爽乐】红烧8+香辣8+排骨8,,20639082744,5,0.9980544071524536,一直回购康师傅方便面简单快捷用开水泡煮都很好吃，味道也是很好吃，每次都得吃俩包从小就喜欢吃康师傅家的方便面，后来出了这就款劲爽拉面后就独爱了，吃起来真的很筋道劲爽，口味一如既往的香而且我这次买的是红烧和排骨两种口味的
【劲爽乐】红烧8+香辣8+排骨8,,20657286194,5,0.9999934379040538,这是我第三次在京东上购买这款产品了，在京东上购买东西就是信任京东的品牌，买东西品质有保障，发货速度很快。这款产品品质一直很不错，值得购买。
【劲爽乐】红烧8+香辣8+排骨8,,20622913128,5,0.9999860933543288,是正品，跟商店里买的是一样的，在这网购方便快捷，品质放心，还会光顾！.^^.挺好的，价格适中，质量看着不错质量很好，买的很合我心意，棒棒哒！需要的亲们可以放心购买
【活动冲量】9味24袋全家福组合,,20597734031,5,0.9999999279233097,康师傅方便面，泡面袋面劲爽乐拉面24袋整箱装家庭装，速食休闲零食夜宵9味24袋全家福组合，一碗劲道好面，经典好味不变，国民认证，从小吃到大，美味的秘密，酸爽好回味，鲜养好活力，淑麻清鲜香，大品牌，吃起来很放心，面的质量非常好，赶上活动购买非常的划算
【劲爽乐】红烧牛肉面*24袋-原箱,,20600664796,5,0.6442982267528603,满满一箱24包，选了葱香排骨味和红烧牛肉味，2种口味，都非常好吃，面条劲道，汤鲜味美，加点挂面吃做早饭很好。快递没有损坏，面条没有碎的。 卖家的服务真是周到细致！他们不仅耐心解答我的问题，还给予了很多实用的建议。物流速度也很快，让我及时收到了商品。
【劲爽乐】红烧8+香辣8+排骨8,,20546937850,5,0.8820360767158201,一起买的，分批次来的货，放在家里备用的。挺好吃的，但是料我一般都不全部放，太咸太香，还是放少点的好。一起买的挺划算，分开买就贵了点。还是很不错的。
【24袋整箱装】老坛酸菜牛肉面,,16768401563,3,0.28797536457023964,没时间做饭时候吃将就吧
【经典袋面】红烧牛肉5连包,,20587180931,5,0.990898281365135,"BZ每袋合到八元多,购物方便快捷,早上下单过午就到了,因为刚好有券做活动,康师傅红烧牛肉面太值得信赖了,很喜欢这款番茄鸡蛋味,日期新鲜出炉,快递也很好,从小就喜欢吃康师傅红烧牛肉面,家里的东西一直在京东上买,价格真的超级合适五星好评~"
【杨紫推荐】番茄鸡蛋牛肉5连包,,20543447050,5,0.9540384624094157,京东自营，商品没问题。生产日期很新，物流速度非常快。很喜欢这款番茄鸡蛋味，汤不是很油，喝起来不错。囤着下班应急
【上新】双萝卜牛腩面5连包,,20562372835,5,0.9297004542202315,新口味买来尝一下，晚上下的单隔天就到了方便快捷，现在感觉这个口味还不错，这个面用锅煮才好吃因为面更劲道一些，康师傅面很不错。好吃以后再买。
【经典袋】酸菜牛肉5连包,,20613612194,5,0.9992763655649546,老坛酸菜，吃起来很是不错，特别是肚子饿的时候。刚好买来这次出差用，很久没有长时间坐火车了，有东西吃还是很不错的呢，网上确实比实体店要便宜很多！
【周深推荐】老母鸡汤面5连包,,20585751491,5,0.04332602464536717,孩子不能吃辣的，所以说就选的这款老母鸡汤面，味道很不错，吃了几十年还是离不开方便面的味道，这辈子看来是吃不腻了，吃不够。孩子不能吃辣的，所以说就选的这款老母鸡汤面，味道很不错，吃了几十年还是离不开方便面的味道，这辈子看来是吃不腻了，吃不够。
【经典袋面】酸菜牛肉5连包,,20559123706,5,0.9999364054997663,这是我常购的商品，味道好性价比高，面饼大，刚好可以吃饱，酸酸辣辣的，特别喜欢这个味道，物流快态度好。京东商城，值得信赖，五星。
【经典袋】双萝卜牛腩5连包,,20612807509,5,0.9999999999946505,康师傅方便面好吃，这款带胡萝卜的牛肉面，汤汁特别的香，味道很浓郁，比单牛肉面更好吃。而且价格还便宜，非常不错的活动。京东购物质量有保证，省心，物流快，基本都是当日达，次日达。很满意的一次购物，收到的商品和图片一致！描述的很准确，商品质量也不错！物美价廉，性价比很高！发货速度很快，包装也很完整！卖家服务态度很好，沟通顺畅，回复及时！快递速度很快，物流服务很棒！
【经典袋】双萝卜牛腩5连包,,20620308023,5,0.9292192522311317,在网上看见很多人是哦这个味道的好吃，就买来试试啦。还想着萝卜能有多好吃呢。不过我还没有吃啦。物流很快，同城每次都是第一天下单，第二天就送到了。上次买到这么好用的东西还是上次！
【周深推荐】牛尾汤面5连包,,20580654046,5,0.7273742706950088,没想到深深代言的产品这么好吃！年货节搞促销买入简直太划算了。说是牛尾汤面，其实是四川火锅底料味道的泡面，但是确实很好吃，一口气吃了四袋，希望再有活动啊
【经典5包】酸香爽金汤肥牛5连包,,20589362846,5,0.9999990060296485,十几种口味，永远吃不腻！！最爱泡椒和酸菜！！！巨好吃嘻嘻嘻，当时买的时候还在犹豫价格，买来之后一点都不后悔，而且物流还快，可以入手 这个商品超出了我的期待！不仅质量上乘，而且功能齐全，性价比很高。卖家的服务态度也非常好，让我有了愉快的购物体验。
【周深推荐】老母鸡汤面5连包,,20592457037,5,0.9999999685042827,性价比很高的  康师傅方便面 老母鸡汤 泡面袋装速食 五连包  周深代言      ，宝爸宝妈亲测有效家有大宝二宝，都很喜欢值得信赖，可以无脑下单哟昨天下单，第二天就到货了，京东快递速度就是快，值得信赖。主要是性价比高，值得五星推荐，值得大家购买～会回购的。
【经典袋面】鲜虾鱼板5连包,,20560434484,5,0.11138499682824388,发货速度很快，包装完好无损，日期新鲜出炉。独立小包装设计，方便携带和食用，一直喜欢清爽的鲜虾味道，面身劲道，不会泡烂的那种。
【经典袋】双萝卜牛腩5连包,,20619011826,5,0.9999543921921316,大萝卜很白很甜。洗完之后很顺滑，猫狗都爱吃，尺码很合适，穿上身后微调一下声音很清脆不打品，很小的水压就能220v稳压疏通经络，很省天然气，一点就能充分燃烧整个房间的芳香，骑行携带方便收纳，2吨的重量放在口袋就能飞到4公里外信号接受无干扰，一键自动摔到地上也不会坏，孩子爱吃。
【经典袋】红烧牛肉5连包,,20651593152,5,0.5257225933331977,方便面，口感好，很好吃，很新鲜，味道很好物流很快，昨天下单，今天就收到了，还没用，先给好评！包装很好，没有破损，打开后没有异味
【经典袋】鲜虾鱼板5连包,,20648406224,5,0.9987978087503433,这款非常好吃，试买了好几款，发现这款最好吃，，以后选定这款，京东买东西方便，价格实惠，最重要的是物流方便，都是送货上门，点赞
【经典袋】红烧牛肉5连包,,20649875580,5,0.9998762354718694,从小就喜欢吃康师傅红烧牛肉面，孩子也喜欢吃!时不时地吃吃下很好吃!超爱家里的东西一直在京东上买，方便快捷，物美价廉!送货也快!而且送到家很方便
【经典袋】金汤肥牛5连包,,20618265671,5,0.781818576885302,京东速度，晚上下单第二天上午到货给力。特别入味，面饼很大，面条劲道好吃，生产日期非常新，放心购买，吃完还会回购的，价格实惠。
【周深推荐】老母鸡汤面5连包,,20587791993,5,0.9999926993434834,康师傅老母鸡汤面，新口味，之前没怎么吃过，好吃不错，外观和描述一致，完全超出期望值，发货速度非常快，包装非常仔细、严实，运送速度很快，很满意的一次购物。京东自营的产品品质有保障。
,,462365440,3,0.7722026677624787,物美价廉送货上门产品
【周深推荐】老母鸡汤面5连包,,20584074756,5,0.9999270897089919,康师傅方便面，质量保证，特别是老母鸡汤面，香味十足，特别是汤非常好吃的，老母鸡高汤包配味非常好吃，物优价位，京东自营物流很快，今买明到手，0k。
3口味24袋装,,20580731274,5,1.0,总体来说，确实很不错，客服的服务态度也很棒，说话几乎马上就会回消息，物超所值，真心推荐物美价廉，很OK，比实体店优惠太多了东西比我想象中的还要完美，十分给力，值得入手外观设计漂亮，尺寸大小合适，包装仔细完整，宝贝手感不错，感觉很好，发货速度快，服务态度一流，给力！5星好评！总体来说，确实很不错，客服的服务态度也很棒，说话几乎马上就会回消息，物超所值，真心推荐东西比我想象中的还要完美，十分给力，值得入手总体来说，确实很不错，客服的服务态度也很棒，说话几乎马上就会回消息，物超所值，真心推荐 这个商品超出了我的期待！不仅质量上乘，而且功能齐全，性价比很高。卖家的服务态度也非常好，让我有了愉快的购物体验。
6口味共24袋（不指定口味）,,20542145618,5,0.9999680283021543,白象是大品牌，我己经买了好几次，吃了味道不错，特别香，包装品质很好。 卖家的服务真是一流！他们把顾客的需求放在首位，耐心解答疑问，并提供了专业的建议。物流速度也很快，让我迅速收到了商品。
【4口味24袋装】,,20546654690,5,0.9999999374681529,发货速度很快，卖家服务也好，目前很满意，整体来说，还是很好的，非常值得再次回购，已经回购好几次了，味道很不错，吃完会再来。 这个商品超出了我的期待！不仅质量上乘，而且功能齐全，性价比很高。卖家的服务态度也非常好，让我有了愉快的购物体验。
汤好喝金汤肥牛面24袋,,20605280811,5,0.9381031250414714,白象中国家喻户晓的方便面牌子，味道好极了，货真价实，确实实惠，性价比挺高。冲然后味道香喷喷的，面条挺Q.弹好吃。味道也非常好。
7口味24袋,,20602039321,5,0.9999611709649306,包装十分精美，有好多种口味，看起来很好吃。吃了之后，感觉口感很好，每种口味的都超级好吃。很喜欢这家的，下次再来购买！
【2口味24袋装】,,20609795959,5,0.9999999998225941,这个是真的好，材料和做工都特别精致，做工真的非常棒，我觉着我可以推荐给我朋友买想买的别犹豫哇！没有廉价的感觉，很高端，特别棒！发货很快，已经收到货了，商品和描述的差不多，质量没问题，关键价格也合适，在这里买还是很放心的，好评！正品，买的放心，价钱也公道，满意！东西质量还可以，快递速度也很给力
6口味共24袋（不指定口味）,,20624568372,5,0.9821346010515638,味道。白象方便面的味道直很不错，特别是汤底浓郁，被认为比大多数方便面的汤都更好喝。许多人口味，如招牌猪骨汤面，被广泛推荐。
6口味共24袋（不指定口味）,,20576155336,5,0.999678863124766,国产大牌子，面劲道十足，香气浓郁，汤汁浓厚，口味真的很好，价格也绝对亲民，支持国货，快递速度一如既往的快，快递小哥服务态度很好。
7口味24袋,,20631217390,5,0.999999999999988,白象汤好吃系列方便面，绝对是我心中的方便面之王！它的面条劲道有弹性，口感超级棒，每一口都能感受到满满的面香。汤底更是鲜美浓郁，让人回味无穷。无论是清晨匆忙的早餐，还是深夜寂寞的夜宵，一碗热腾腾的白象汤好吃方便面都能瞬间满足我的味蕾。而且，它的调料包也是一绝，辣中带甜，让人欲罢不能。最重要的是，白象汤好吃系列方便面非常注重食材的选择和烹饪工艺的把控，让我在享受美味的同时，也能感受到品牌的用心和诚意。总之，白象汤好吃系列方便面，是我每次购物清单上的必备之选，强烈推荐给每一个热爱方便面的朋友！
汤好喝浓汤豚骨面24袋,,20639544556,5,0.9480333814445726,方便面已经收到，完美，一点也没有破损，包装完好！方便面比实体店便宜7块钱，物美价廉！这款方便面食用很方便，味道好极了，一次一包刚刚好！赞！
3口味24袋装,,20590055737,5,0.9999996055197771,买了满满一箱快吃完了才想起来评价，泡面煮面涮火锅炒干锅都可以拿来配，汤好喝面劲道物流很快，质感很好，很漂亮，很喜欢是理想中的产品，质量不错，物流也很快，值得点赞
汤好喝老母鸡汤24袋整箱,,20638311137,5,0.03760258843774322,商家有心了，在纸盒外面又裏了塑料膜。吃过几款白象面，最喜欢这老母鸡的。味道鲜美，无添加怪味，份量十足，物美价廉，吃起来放心！京东购物很不错
汤好喝金汤肥牛面24袋,,20615740215,5,0.9992864716721457,非常满意的一次购物体验，商品物美价廉，值得推荐。掌柜的服务也非常周到，有问题都能及时回复解决。非常好，支持国货，支持国货。
汤好喝羊肉汤面110.5g*24袋装,,20624939631,5,0.9999526729224998,质量可以说是非常好了，与卖家描述的完全一致，非常满意，真的很喜欢，完全超出期望值，发货速度非常快，包装非常仔细、严实，物流公司服务态度很好，运送速度很快，很满意的一次购物
6口味共24袋（不指定口味）,,20655794762,5,0.999999996843169,物超所值，非常满意，期间有点小插曲，店家细致周到的服务让人很感动，祝生意兴隆，还会再来宝贝收到了，和描述一样，很喜欢商品质量不错，细节、品质、做工都非常好，发货贼快，快递也给力，棒棒哒~
老母鸡汤面20袋+香菜搪瓷缸,,20546692153,5,0.9584626778297296,吃了一圈，最后还是回到白象，汤好喝，面也劲道。有活动就买点，反正是家庭常备的，煮也行，泡也行，两种吃法两种味道。良心企业大赞！
【4口味24袋装】,,20561090067,5,0.8114533837680442,这款汤好喝是白象方便面品牌中的精品，面块大而且料包足，出来的汤美味，面有劲头，而且可以搭配口味。不至于吃腻而且商家客服好，物流速度快
4口味24袋装,,20558240033,5,0.9997986568753308,不错不错，吃了一包口感还是不错的，再加上物流还是挺快的，客服服务态度也挺好的，下次会继续回购的，也会推荐给身边的朋友来买，
汤好喝酸酸辣辣豚骨面24袋,,20397696319,5,0.9999699165050558,支持国产，白象这个系列的面很不错。煮出来的面饼筋道，面汤醇厚，量也很足，一袋充饥，两袋饱腹，精华是汤。喝一口很有满足感。这个口味又香又辣，很满意。
老母鸡汤面24袋装,,15509728149,3,0.9286106335546761,产品不错，就是有点碎了
【经典】藤椒牛肉面*24袋-原箱,,20549232234,5,0.9996521472822818,家人都喜爱吃这个，很不错的，偶尔下班累了，不想做饭，搞点蔬菜，很方便，来一包，味道正宗，质量可靠，值得推荐！爱了爱了！！！！
【活动冲量】12味24袋全家福套餐,,20601440422,5,0.9999143445164398,京东大品牌值得信赖，物流真是特别快，第二天就送达了，满满一大箱，有很多种口味，这下可以试试看哪个口味好吃，以后就买这个口味的啦，烹煮起来真是太方便啦
【活动冲量】12味24袋全家福套餐,,20582961824,5,0.999715586767582,物流速度快，食用方便，康师傅知名品牌，种类多，包装完整没有破损，分量多，物美价廉够吃很长一段时间，这是非常满意的一次购物
【店长推荐】红烧牛肉面24袋,,20554191344,5,0.025366895975841297,买了京东PLUS 会员，常在京东买东西，订单太多，不想每个产品都写好评，所以特地写下这个模板，以前不知道一评论可以涨积分，现在才知道好评的重要性，妥妥的每条都来评论下，曦积分，下次还能抵现金用。评论30个宇以上，可以得到20个京豆，我无论买什么东西都会把这个段话复制粘贴下凑够宇数。这是第 N 次在京东买东西了，东西便宜而且质量好，物美价康，买的放心，用的开心，感觉都买上，爱了买买买根本停不下来，东西品种多而且叉特别全，划算方便，而且安惠，包装很好，而且没有任何损坏，会一直支持下去的。
【活动冲量】12味24袋全家福套餐,,20641224327,5,0.9999357705560437,混合口味简直是选择困难症的福音，不用纠爱什么味道，直接闭眼入，还尝试了很多新味道，特别好，很方便，每种口味两包，可以尝很多新味道
【经典】酸辣牛肉面*24袋-原箱,,20582217842,5,0.9985910839369221,康师傅酸辣牛肉面好吃，一直在吃这个口味的泡面，每次都会买上一箱，回来不愿意做饭吃一袋，时间太晚了，做饭来不及吃一袋，美滋滋，大品牌值得信赖，推荐购买哦！
【24袋】红6+鲜虾6+母鸡6+牛尾6,,20646959590,5,0.02510192348766671,之前一直买康师傅的方便面，康师傅方便面味道浓郁，吃起来很香，可是以前都是吃经典的红烧牛肉面和鲜虾鱼板面，有点腻了，所以这次选择了牛尾、红烧牛肉、鲜虾鱼板和母鸡汤面等4种口味的，第二天晚上就泡了母鸡汤面来吃，味道还是挺浓的，一如既往得好吃，面料的量也足，老品牌了，物美价廉！爱了！
【店长推荐】红烧牛肉面24袋,,20565167087,5,0.9995083647375148,京东的物流一般情况下都不会让人失望，很快，方便面家庭必备，偶尔可以吃，这个品牌也很多年了比较信赖，赶上凑单多买一些比较合算
