ProductColor,ProductSize,ID,score,sentimentScore,content
魅影MINI黑（M-ATX/快拆）,,20606553382,5,0.9999999998448827,外观干净漂亮，做工很不错，没发现什么瑕疵，个人感觉大小也挺合适，找了很久选的这款，大爱！宝贝确实很棒，个人非常喜欢，朋友也说好来着，推荐购买实物与描述的一样，质量相当好，卖家态度也好，有问必答，发货速度杠杠的，值得购买哦
 魅影MINI白（M-ATX/快拆）,,20606553812,5,0.9999998944076136,发货很快，包装的很好，价格也特别实惠，还有这么多功效也是不错了，值得购买物流满分，包装快递满分，配送员态度满分，购物让人开心，吃土使我快乐~
 魅影MINI白（M-ATX/快拆）,,20661754876,5,0.9234119517477237,先说商品质量:产品总体不错，包装严实。再说说商家服务:点赞啦。最后点评快递:发货很快。其他就是感谢店家打折送券活动，毕竟便宜好货更实在。希望店家多多优惠，及时通知老客户，促成回购。祝生意兴隆
魅影MINI黑（M-ATX/快拆）,,20620352564,5,0.9999999998448827,外观干净漂亮，做工很不错，没发现什么瑕疵，个人感觉大小也挺合适，找了很久选的这款，大爱！宝贝确实很棒，个人非常喜欢，朋友也说好来着，推荐购买实物与描述的一样，质量相当好，卖家态度也好，有问必答，发货速度杠杠的，值得购买哦
 魅影MINI白（M-ATX/快拆）,,20680311181,4,0.9215886502677563,星驰出品，精品开的，150左右的机箱真的经验到我，做工真的好好，边角位，背线那些都做得不错，玻璃也有厚度，快拆板这个价位经验到我。不好的就是不配风扇
魅影MINI黑（M-ATX/快拆）,,20633316090,5,0.9989092519473219,完美装机一次点亮第一次自己手动装机很有成就感过程虽然曲折但是装上了一步一个脚印用了几个小时装好的很不错很不错
魅影黑色（支持40系显卡）,,20104361973,5,0.9998429047679195,内部空间：空间巨大，走线好走，rgb一开贼好看做工质量：符合这价位的用料做工，没啥太大惊喜散热效果：散热效果很好，侧边两风扇很好用外形外观：无立柱的机箱就是好看
魅影白蓝星曜娘定制款,,20059407589,5,0.9964778388515865,内部空间：很大非常宽敞做工质量：机箱味道比较大，希望不用等很久散热效果：风扇位和电源位均有风道，但是机箱本身应该是比较保温的材质，需要充足的机箱风扇外形外观：纯白外观很亮眼，但是这个线材是谁想出来用黑的，做纯白海景房的慎重产品包装：京东自营，包装值得信赖
魅影MINI黑（M-ATX/快拆）,,20273373730,5,0.013489274102558957,颜值不错，机箱小巧，缺点是硬盘盒支架明明可以做大点放入两块3.5 硬盘，缺做小只能放一个3.5一个2.5，铁皮有点薄，对得起这个价格吧
魅影黑色（支持40系显卡）,,20218877947,5,0.9973628953117407,包装很好，快递给力，卖家很有信誉，发货速度也很快。价格更是比别家的实惠多了质量非常好，与卖家描述的完全一致，完全超出期望值，包装非常仔细，很满意的一次购物
魅影白色（无立柱海景房）,,20139434014,5,0.9993546656064684,机箱太好看了，下次继续买希望这个不会停厂内部空间：大做工质量：好散热效果：非常棒外形外观：好看
 魅影MINI白（M-ATX/快拆）,,20618000457,5,0.8795351073109942,颜值即正义。机箱买了好久一直没工夫换，最近才有空换上，全白还是很好看的
魅影MINI黑（M-ATX/快拆）,,20567171225,5,0.01606055121676786,机箱包装非常完善，京东物流很给力，尽管在装机的时候遇到了点问题，店铺客服很快也解决了
 魅影MINI白（M-ATX/快拆）,,20670189198,5,0.3007195497511338,好看！质量不错，拆卸方便，女生轻松安装，客服态度也很好
魅影MINI黑（M-ATX/快拆）,,20657022242,5,0.9998989983649493,外形外观：产品非常不错，做工精细
魅影MINI黑（M-ATX/快拆）,,20481034916,5,0.9993857948687602,小巧精致，配置ARGB装机效果非常不错
魅影白蓝星曜娘定制款,,20011289429,5,0.1263930946961589,包装很严实，好评，等装好机再来评价
魅影白蓝星曜娘定制款,,19265326432,1,0.00046373494051354935,紧固件垃圾的一塌糊涂。也不知道老板是不是打算省这五毛一块的给老板娘买宝马？
魅影白色（无立柱海景房）,,20138744343,5,0.8361094766041633,机箱特别漂亮，透明海景房
魅影MINI黑（M-ATX/快拆）,,20492549020,5,0.8071438861297672,挺好的，质量过得去，价格偏贵一点。
天幕MINI黑（支持MATX/240水冷/32显卡,,20641574687,5,1.5695685418037897e-08,机箱颜值很高，弧面屏。散热孔尺寸合理，底下和上边都有磁吸防尘网。背部理线空间，我是全模组插满线的可以很轻松放完，还可以塞到硬盘位。前边主板下也有多个理线孔方便走线。机箱的材质很足，铁也比较厚实，最近买了五个200左右的机箱，这个的我是觉得效果最好的，三百以内性价比无敌。主板不是大板其他的尺寸都能放下。扣除上边240水冷位，还能装下五个风扇，装的利民风扇很厚但还是不影响空间。显卡位可以放348.5*159.5*60.5这个尺寸显卡放完还能装的下，还有空间，更长和更宽的也可以放得下，我估计可以放下350*161*80尺寸的显卡，放完显卡可以盖的上玻璃板。
天幕黑（支持MATX/360水冷/40显卡,,20662663730,5,0.9998520964224424,百亿补贴选购的，发货速度很快，包装完整无破损。做工用料很扎实，分量很足哦。值得选购！内部空间相当的大，布线不行，有点乱，还得继续努力学习布线。
天幕MINI白（支持MATX/240水冷/32显卡,,20641768853,5,0.9999992649000738,基本没有认真评论过，不知浪费了多少积分，这个福利真的不错，妥妥的每次写100多字，这已经不知道N次在网上购买东西了，东西便宜，质量好，物美价廉，买的放心又开心，这真是买东西上瘾的节奏啊，根本无法停下来，品美多，而且齐全，划算，方便，快捷，实惠，包装又好，没有任何破损，简直是消费者的福音，会一直支持下去，京东可以逐不出户的懒人就能购买到的日常生活吃喝玩任何东西，真是太合适不过了。
天幕白（支持MATX/360水冷/40显卡,,20652984379,5,0.9999864569990625,做工质量：做工挺好的，质量过关外形外观：就是奔着它的外观才买的，赞内部空间：内部空间如图，就差一个显卡了，空间还是很充裕的
天暮MINI黑+棱镜四代ARGB七风扇,,20122784001,5,0.9993238536951964,包装:外箱结实，内部防护和固定很好服务:热情专业，比官方店专业商品:外形尺寸较好，长和高都不超40厘米，随便放角落。内部空间很大，利民PA120安装无压力，安钛克超级硬的线也可以走线，后面电源上面有个带挡板空间可以放控制器和乱七八糟的线颜值:全景不带立柱还是非常漂亮的，风扇装满闪起来也不错。做工:机箱相对于价位来说不错的，但是和原来的鬼斧比较起来确实不在一个档次，风扇也是如此。
天暮MINI白（支持MATX/240水冷/32显卡,,20106207313,5,0.006121961527463915,机箱挺漂亮的，不过说明书很不专业，就薄薄的一张纸还看不清晰那种。要凑50字挺难的，就打一堆废话在后面吧，反正机箱看着还可以
天暮MINI黑（支持MATX/240水冷/32显卡,,20069847537,5,0.0017145558173536912,很好看的机箱，喜欢有弧度的边缘，风扇没装在侧面感觉不够地方，可能是自己装机没弄好线的缘故&hellip;&hellip;总之很不错！
天幕MINI白+棱镜四代ARGB七风扇,,20696394752,5,0.9998363256381262,终于收到货了，非常非常喜欢，做工精致漂亮，已经被很多人夸了，真的太开心了，已经是他家的忠实粉丝了，以后还会继续买买买的
天幕黑（支持MATX/360水冷/40显卡,,20484496919,5,0.8066264131286438,非常的好，和老板沟通也很愉快，很大，很重，就是我这边风扇还没到，如果到了拍照能更好看。
天幕白+棱镜四代六风扇,,20681125286,5,0.42375909354639596,机箱很有质感，用料很扎实，也没有出现变形的情况，拆装十分方便。
天幕MINI黑（支持MATX/240水冷/32显卡,,20701549855,5,0.9533384750359115,还没装机  颜值这快没得说 很喜欢 店家也给说了详细的教程
天幕MINI黑（支持MATX/240水冷/32显卡,,20673308397,5,0.8938451157382388,机箱很漂亮，大小合适 适合桌搭
天暮黑（支持MATX/360水冷/40显卡,,20192490748,5,0.9924436088146575,包装完好，很有性价比。
天幕MINI黑（支持MATX/240水冷/32显卡,,20486166109,5,0.9850651990477334,满意，物流也很快，家人很喜欢
天幕白+棱镜四代六风扇,,20635310376,5,0.7826200170328205,不错，没有坑，卖家很nice
天幕MINI白（支持MATX/240水冷/32显卡,,20558061157,5,0.9856129068133539,整体还算满意，大小放在电脑桌上面正好，里面一览无余
天幕MINI白（支持MATX/240水冷/32显卡,,20648218991,5,0.9780847558720271,还不错啊啊啊啊啊啊，然后我的时候到时候可以可以可以
天幕MINI白（支持MATX/240水冷/32显卡,,20666207252,1,0.6940016579911918,笑死 那么大一只说自己mini
天幕黑（支持MATX/360水冷/40显卡,,20629767892,5,0.8728467158406888,机箱尺寸合适价格实惠 看实物安装也方便适合装机使用  过几天装完了再来评价发图了
天幕黑（支持MATX/360水冷/40显卡,,20692233687,5,0.3442011275959679,小问题客服马上就解决了，赞！
【三边防护】更安全-热销款,,20662130402,5,0.9465344280445176,颜值高，质量好。万向轮可方便滚动，可锁住固定好材质手感不错，有质感高级感是承载电脑主机的坚实托盘。接下来好好使用
【三边防护】更安全-热销款,,20681668556,5,0.9027278334518244,电脑主机托盘使用很方便，产品质量很好，一体成型，设计合理，移动方便，放在办公桌下面很合适，大小尺寸刚好，材质硬度很高无异味。
【三边防护】更安全-热销款,,20694275653,5,0.9938171488935567,高端大气上档次，低调奢华有内涵，这款底座真的太能装了，放在家里可以把重要的仪器放在桌子上，保护一些重要的仪器不受水淹等危险，或者放在其他地方，用于整理收纳真的是太到位了，妥妥的神器，强烈推荐大家使用，已经回购过无数次了，下次有需要还会再来
【三边防护】更安全-热销款,,20683939041,5,0.9999042741205619,不错，非常好的一款产品，非常好的一款商品了，京东快递物流非常的快，非常好的配送员，值得拥有，值得推荐一下，值得推荐购买。
【不带挡板】更方便,,20675252934,5,0.8351343056606493,搬新家电脑需要有地方放，这款性价比特高，轻巧牢固，拿进拿出也方便，放上电脑也挺漂亮，轮子锁住时也能轻易拉动，可能是塑料轮子容易打滑。
【三边防护】更安全-热销款,,20410064512,5,0.9782337824961854,京东送货超级快，包装的也很结实，打开看质量不错，做工精细，无需安装，打开即用，放在电脑主机下面移动起来太方便了，而且还干净卫生好清理。
【三边防护】更安全-热销款,,20472443931,5,0.9964460956816298,早就想着要选择一款机箱托盘，正好赶着过年放假就下单了这款，放假没事把电脑整理了一下看了很多款，还是对这款托盘比较中意，外观简洁，而且已经使用过多款奥睿科的产品，都很满意，这款托盘也非常的满意，轮子滚动很顺滑
【不带挡板】更方便,,20543718522,5,0.999888555983983,这是一款非常出色的产品！质量非常好，细节做得非常到位，使用感非常顺手。不仅如此，客服服务也非常周到，效率非常高。购买这个产品绝对是明智的选择，强烈推荐！
【三边防护】更安全-热销款,,20380139054,5,0.9806908307832244,之前显示器是一直放在桌子上的，现在买了这个以后，已经成功的挪到桌子下面了，带滑轮的，移动起来特别方便，特别好用，非常满意的一次购物，赞
扩展卡【PCI-E转USB-C 20Gbps】,,20467268413,5,0.9687125833431929,PCIE转接卡，20G传输速度非常快，适合经常拷贝大文件用户使用，PICC质量承保，品质卓越有保证！京东物流运输速度快！
【三边防护】更安全-热销款,,20528232603,5,0.9999445496972268,做工精细，外形美观。东西比我想象中的还要完美，商品无论产品质量，还是售后服务都是超级超级好！强烈推荐给大家！性价比很高！！
【三边防护】更安全-热销款,,20527274450,5,0.9991818115067874,质量很不错，非常结实，这已经是是买的第四个了，给办公室买的，安装起来也很方便，把四个轮子直接插到孔里就行了，避免了主机跟地面直接接触。 卖家的服务真是周到细致！他们不仅耐心解答我的问题，还给予了很多实用的建议。物流速度也很快，让我及时收到了商品。
【不带挡板】更方便,,20479709951,5,0.999998704787542,性价比高，我很喜欢，下次还会光临东西很满意哦，美观时尚大气，客服超级有耐心，服务细致贴心，大品牌就是不一样
【三边防护】更安全-热销款,,19998370776,5,0.9999999997731028,完美适配冰立方机箱，做工精致，外观漂亮，细节也是可以的值得购买的产品，做工非常精细，比想象中的好，推荐大家尝试高颜值，高品质，非常好，一分钱一分货，材质外观和质量一看就很上档次，非常喜欢
【三边防护】更安全-热销款,,19990023942,5,0.999874754451294,今天收到，马上放上去。大小尺寸很合适，尝试推拉效果很细滑，手感也不错，挺结实的。使用过过再来评价。目前体验感很好
【三边防护】更安全-热销款,,20183314069,5,0.0011414914662002396,非常好的一款主机支架，房间地面铺上了地毯，主机直接放地上容易堵风口，所以买了这个主机架，大小刚刚好，活动灵活，很实用，以后有需要还会再来，给厂家点赞。
三边挡板主机支架 大号,,12867637967,3,0.4981542475171269,还好，就是快递没填充物之
【三边防护】更安全-热销款,,19982550772,5,0.9898513677150353,质量好，送货快，昨天下单，今天就收到了。京东快递服务给力，快递小哥服务好，细致周到这个电脑主机架非常轻便，安装省事省力，女生安装不到三分钟，尺寸合适，滑轮顺滑。点赞
【三边防护】更安全-热销款,,20106468981,5,1.0,好评模板复制：价格实惠，质量杠杠的，非常好的一次购物，下次还来很好看，制作工艺很精美，材质也很好！给个赞！快递很快，质量棒极了，建议购买特别特别特别好，没有任何破损的地方，外观也好看，好评！头一次评论啊，该怎么说呢，打多少字才能表达我对这件衣服的爱？会不会成热门啊？我写的这么好会不会太招遥啊？写的这么深奥别人会不会看不懂啊？质量很好哦，发货也很快，一家非常喜欢的店铺，我要疯狂推荐给朋友们非常值得信赖的品牌，质量有保障，价格还亲民，相当满意质量非常好，完全超出期望值，发货速度非常快，包装非常仔细、严实，很满意的一次购物(*^__^*)非常满意的一次购物，物有所值，比实体店里实惠多了！宝贝收到了，很惊喜，质量非常好，很满意的一次购物。我会继续回购的，店家值得信赖
【三边防护】更安全-热销款,,20333705013,5,2.916175377620789e-06,大小刚刚好，塑料一体成型的，非常轻便。以前主机放在桌子上，比较占地方，打印机没法放置，现在把主机放到桌子底下，桌子上放打印机，非常方便。
本色K13【形美器利 8风扇位】,,20611551698,5,0.9933815816820639,长城是老品牌了，坚持踏实做产品，本来试试看，毕竟这么便宜，到货发现机箱还真不错，虽然便宜，但是做工用料一点也不差，装机完看起来真不错，所有功能正常，完美无瑕疵，高兴
铁幕H503B【360水冷 4090显卡】,,20658153377,5,0.999787803055539,外观看着高大上，黑化神秘感十足。，内部空间大，显卡按进去绰绰有余。散热效果好，安装简单，重量足。支持背线，电源下沉。硬盘位置多，可扩展性好。
马里亚纳【360水冷位 E-ATX】,,20652287637,5,0.9989319652849059,内部空间：超大做工质量：很不错散热效果：两面还是三面有散热孔外形外观：还不错产品包装：包装还OK，保护措施也到位，没有发现磕碰什么的。这个机箱的尺寸是我万万没想到的，居然那么大，看图片还以为是我想象中那种尺寸，结果超级大，哈哈，给仓库买的，估计他们也会觉得太大了。
本色K13【玻璃侧透 支持4080】,,20684485016,5,0.8360768679427191,机箱还可以，挺不错的，非常好，希望能用很久不会坏，过这天还会过来购买，还要加人，很多主机需要现金，，外观很好，买了几个，有些变性了。
阿基米德9W【360水冷 4090显卡】,,20646909322,5,0.9999999881106275,内部空间：挺大的，还以为放不下，没想到可以。做工质量：做工很不错，给公司买的，这外观，看得我都想买台回家。散热效果：散热效果还可以。外形外观：外观挺漂亮的，白色、透明。产品包装：包装挺安全严实的。
冰霜X3【360水冷位 磁吸翻门】,,20658473829,5,0.9970566144858727,长城的机箱一直就不错，内部空间较大，安装的时候比较方便，散热做的很好，外形很酷，且留了多个风扇安装位u，是搭海景房的理想机箱。而且价格也比较实惠。推荐推荐
本色K13【形美器利 8风扇位】,,20616683433,5,0.9982995548434835,新款K13机箱，采用玻璃侧透面板，时尚，大气。做工扎实，用料厚实，内部空间大，布局合理，散热空间。发货速度快。经济实惠的好机箱。
本色K13【形美器利 8风扇位】,,20620242030,5,0.999999999969071,机箱外观：外观设计简洁大方内部空间：内部空间充足，装机过程很流畅，不卡顿做工质量：做工很好，钢板不是用的很薄的那种，长城不愧是大品牌散热效果：风道合理，散热效果很不错！
阿基米德9W【360水冷 4090显卡】,,20600252690,5,0.999994320149366,机箱外观很漂亮，简约，很大气，很好看，看起来很结实，颜色也很正，很有质感，内部设计也相当合理，走线很方便，配件非常齐全。
本色K13【形美器利 8风扇位】,,20604980086,5,0.9997609939746547,长城新款K13机箱，玻璃侧透面板，更时尚，更大气。做工扎实，用料考究，内部空间大，布局合理，散热空间大，效果好。发货速度快。
本色K13【玻璃侧透 支持4080】,,20696558741,5,0.9991620409543069,内部空间：空间非常大，玻璃盖板，从外面看非常高大上做工质量：做工非常好，快递包装的也很好。散热效果：散热无敌，散热孔也比较多，可以配8个风扇外形外观：真的是帅，太好看了
本色K13【玻璃侧透 支持4080】,,20686510117,5,0.3812471088221183,之前的电脑就是用的长城的电源和机箱，非常好，五六年没一点问题。宝贝质量很好，收到货第一时间打开看了，很不错，很满意，客服也有问必答，感谢
本色K13【形美器利 8风扇位】,,20651342889,5,0.9999994285564154,内部空间：空间确实很大，支持各类型的主板做工质量：这是帮朋友买的第三个了，价格实惠，实用散热效果：空间大散热效果肯定没问题外形外观：外形简单大气，上档次，产品包装：包装每家不都一样，如果朋友再让我帮他们配电脑，我还会买这款
阿基米德1白【超宽体 玻璃翻门】,,20603076620,5,0.9992716598792462,产品非常好，商品介绍清晰，按需选择，价格便宜性价比非常高，多次购买，使用性能稳定，国产好货，一点不落合资品牌，支持国产商家，振兴中华!
本色K13【玻璃侧透 支持4080】,,20692319820,5,0.2759333313335516,公司配电脑，有个老主板是ATX的，只能买大机箱的！看了看长城这款价格也算最便宜的（电源下置的）收到货整体来说还不错的，板材也算很薄！京东自营送货速度，五星好评
阿基米德9【360水冷 4090显卡】,,20696433408,5,0.9999999999711642,质量很好，做工精细，满意宝贝做工真的非常精细，细节真的棒，爱了爱了网心仪已久，果断下手，用过之后感觉很不错，是正品，快递也很给力，果然名副其实看大品牌，用起来很放心，质量非常好，赶上活动购买非常的划算当时买的时候还在犹豫价格，买来之后一点都不后悔，而且物流还快，可以入手当时买的时候还在犹豫价格，买来之后一点都不后悔，而且物流还快，可以入手
阿基米德KM1白【宽体 适配30系】,,17017089998,3,0.4803266887295041,这个还不错，装说冷方便
本色K13【形美器利 8风扇位】,,20598579078,5,0.8806624201535369,机箱挺不错的，到货包装很好，没有损坏，装机一切正常，活动价性价比对比其他品牌还是比较高的，玻璃很厚实，铁皮不薄，这款支持ATX大板。买过四个长城机箱，都还可以。京东快递第二天就送货上门，点赞。
,,20648149811,5,0.9636027533958226,机箱尺寸合适，组装方便，散热风道布局合理，独立的硬盘仓和主板分离 更加有助于散热和规划布局 对强迫症太友好了 物美价廉，五星好评！
本色K13【形美器利 8风扇位】,,20620788906,5,1.0,机箱评价语1.内部空间：很不错，三个3.5硬盘都放下了做工质量：非常好，玻璃侧板尤其厚实散热效果：太赞了！比之前的机箱降低了10度外形外观：设计酷炫，前置风扇有RGB等效2.内部空间：非常大，我的主板刚好够放做工质量：质感一流，很结实散热效果：风扇够多，还静音外形外观：测玻璃搭配风扇灯效，效果很nice！3.内部空间：空间足够大，设计也很合理做工质量：磨砂金属材质，摸起来就很有质感散热效果：比之前的机箱散热效果好多了外形外观：RGB等效可以神光同步与主板完美匹配4.内部空间：空间够大，以后升级也很方便，尤其是显卡预留位置，能满足所有显卡做工质量：用料很扎实，带侧开玻璃门，很厚重散热效果：散热非常好，上排还可以预装360的水冷外形外观：侧边玻璃门很通透可以展现出RGB灯光效果5.内部空间：空间比较大，不愧是全塔机箱，走线比较富足有很多空间做工质量：板材很厚实，非常完美散热效果：12个风扇位，散热效果非常好外形外观：机箱颜色很耐看，侧透玻璃也很美观。15
H5【ATX/U3/光驱位】,,20650404137,5,0.9994873668015867,多次购买这款机箱了，设计得很好看，端庄大气又美观，内部空间大，扩展性强，散热能力好，USB插口也给得很充足，并且插口区设计在前面不吃灰尘，这点很难得，很满意，可以说是性价比最高的机箱了
H5【ATX/U3/光驱位】,,20602208039,5,0.9133580147204119,新年配新机，给朋友换掉了9年前的主机，速度提升杠杠的，新的处理器和显卡也需要更好的电源来提供充足的动力，整台电脑装好后，风扇十分安静，处理程序起来也是游刃有余，电脑画面显示效果流畅度都有了大幅度提升！
H5【ATX/U3/光驱位】,,20697331078,5,0.9997798874075328,主机箱简洁大方，材质平滑厚实，在平台上浏览多家产品仔细比对后才下决心购买的。产品配件很齐全，与自购的其他零件完美适配，装好后很满意。
H5【ATX/U3/光驱位】,,20603033809,5,0.9994608402297375,物美价廉，很OK，比实体店优惠太多了非常漂亮，做工精细，颜值担当，非常方便，喜欢的朋友可以下手！
,,20626955866,5,0.9999715026429105,第一次用这种机箱，带提手的，对于办公主机来说大小很合适，后期也不会考虑加装显卡之类的，目前来说够用，白色的机箱很简洁大方，不错
 F20【ATX/12个机械硬盘位】,,20664053113,5,0.24773803486124135,看了很多款，最后选择了这个发大机箱，机箱很大，空间够，硬盘位也不少~质量没问题，有安装说明书，京东物流，送货上门，还是很不错的~
H5【ATX/U3/光驱位】,,20681146352,5,0.9917658399547263,第1次买半岛铁盒的机箱，品质比长城的还好，空间大，安装显卡，硬盘，固态硬盘，背部走线都很方便。价格实惠，送货快。无论是新装机还是升级电脑都很好。
H5【ATX/U3/光驱位】,,20636972337,5,0.9996479131573835,性价比高，能三个机械硬盘很赞，分量也足，安装方便，外观好看，散热要等夏天看看了，总的来说，非常值得推荐，希望能用的时间长
