ProductColor,ProductSize,ID,score,sentimentScore,content
混合口味,【20袋】+泡面碗,20597096535,5,0.996888475704426,绝对是最开心的一次购物，店家服务态度很好，售后也是绝对是最开心的一次购物，店家服务态度很好，售后也是绝对是最开心的一次购物，店家服务态度很好，售后也是
上汤排骨,【24袋】无赠品,20628150634,5,0.6169260856376712,好，便宜又好吃，无量天尊
红烧牛肉+香辣牛肉,【24袋】无赠品,20643021739,5,0.8016804477463011,价格实惠，味道香浓！
混合口味,【20袋】+泡面碗,20542976121,5,0.9432898798593239,泡面质量非常好，比在外面买的得劲多了，服务也特别好，态度很棒
红烧牛肉+香辣牛肉,【20袋】+泡面碗,20074387621,5,0.7792049178165281,好好，碗的大小，面饼的质量很好
混合口味,【24袋】无赠品,19565176675,5,0.07133444253501475,货收到后就拆开用了，质量很好，东西和官网买的没区别！
上汤排骨,【24袋】无赠品,19567313676,5,0.9650179289017145,好用好用，质量很好，京东物流速度就是快
红烧牛肉+香辣牛肉,【24袋】无赠品,19253067547,5,0.9788645064162373,好吃不贵经济实惠，非常满意
上汤排骨,【24袋】无赠品,19567314653,5,0.9650179289017145,好用好用，质量很好，京东物流速度就是快
上汤排骨+香辣牛肉,【20袋】+泡面碗,19911950461,5,0.9627022739200227,泡面好吃，值得推荐购买
红烧牛肉+上汤排骨,【20袋】+泡面碗,20610110383,5,0.08928060235686452,购买的时候需要购买个筷子。因为有碗没筷子。
红烧牛肉+上汤排骨,【24袋】无赠品,19693530903,5,0.9162639243527421,还是可以的，就是面饼有点碎。
上汤排骨+香辣牛肉,【24袋】无赠品,20248580340,2,0.7973255317609057,还行，就是有很多碎碎的
混合口味,【24袋】无赠品,20647390170,1,0.34136251518451843,全都碎了，不知道怎么吃
混合口味,【24袋】无赠品,20598058302,1,0.06902555490634943,欺瞒消费   与图片不符
混合口味,【20袋】+泡面碗,20245546761,1,0.01691903364055225,有一股 塑料味不好吃
红烧牛肉+香辣牛肉,【20袋】+泡面碗,20553191971,5,0.005188884016828821,说的是24包发货是20包还有四包呢？商家解释一下
红烧牛肉+上汤排骨,【20袋】+泡面碗,19528703129,5,0.31499398954254,说好送两个泡面碗结果只有一个
混合口味,【24袋】无赠品,19714705456,3,0.8427259848183968,感觉很难跨，吃起来不怎么合口
香辣牛肉,【24袋】无赠品,19310947940,1,0.009789485973619172,味道太差了，口感也不好，早知道不下单
辛拉面5连包,,20620679494,5,0.9906777713706728,最好吃的泡面 无限回购的产品  面饼很好煮 而且煮完的硬度 每次都很有弹性 不软也不硬。汤底的味道也是 微辣 而且很香。放个鸡蛋 配个火腿肠 简直是夜宵之王 我愿称他为泡面之王。太有食欲了 冲
辛拉面(燃辛)5连包,,20601378104,5,0.9040820604872277,最喜欢这个味道的辛拉面了 感觉比普通的要辣一些 但是味道不算特别辣 非常好吃 已经回购了很多次了 还会继续回购 继续支持的！
乌龙面5连包,,20584347779,5,0.7041029788196466,我挺爱吃这款乌冬面的，这个牌子一直在吃，面条劲道，面汤味道浓郁，自己配点菜，真的很美味，吃完会继续回购的，
混合口味8连包,,20563952499,5,0.8443976440746098,买了N多次的农心方便面了，一次可以买到8个口味 面条劲道  味道很不错 辣白菜口味比较辣，喜欢吃辣一点的话推荐这个口味的。
辣白菜5连包,,20565965722,5,0.9987095096435084,味道非常不错一直都在购买这个牌子的泡面.面条劲道有嚼劲.汤汁也很好喝.非常不错.一样购买一种.换着吃.非常不错的一款泡面.
辛拉面鲜虾5连包,,20568077044,5,0.9999991398148261,这款鲜虾味的辛拉面是我的最爱，起码购买了10多年了，口感很好，劲道还非油炸，不像其他品牌那样油乎乎的，很爽口。活动价格实惠，发货速度快，比较满意。
混合口味8连包,,20649371443,5,0.8998094581547773,一直很喜欢吃这个牌子的拉面，最喜欢辣白菜味道的，看到有这个八种口味的拉面，就买来试一下，一次性可以尝到八种口味
辛拉面5连包,,20606172030,5,0.9955262125742304,辛拉面是我家常备的速食品，辛辣的调味，面条劲道，好吃上头。卧个荷包蛋，再加一根泡面必备搭档香肠，一碗夜宵速速搞定。京东商城物流很赞
辣白菜5连包,,20607611946,5,0.9585537819915506,一直在吃农信辣白菜拉面，一点不腻，挺好吃，这次一起买了两包。日期新鲜，包装也完整无损。物流也很快，快递小哥送货上门，很方便。
混合口味8连包,,20618414129,5,0.887589367631499,辛拉面非常好吃 这种八连包非常棒，每种味道都能尝尝鲜，可以选择自己最喜欢的泡面味道回购啦，保质期都很新鲜，快递是纸箱包装收到没有损坏
辣白菜浓情芝士5连包,,20583271355,5,0.9953160389390886,早就听闻农心拉面好吃，以前一直没有条件在宿舍煮了吃，现在买了锅具可以吃美食啦，买了最喜欢的芝士口味，也很喜欢辣白菜，希望好吃
辛拉面(燃辛)5连包,,20563249557,5,0.9999839941798538,发货很快，已经收到货了，商品和描述的差不多，质量没问题，关键价格也合适，在这里买还是很放心的，好评！宝贝收到后很满意，外形颜色也很喜欢，挑选好多家，果然没看错，希望把好物分享给大家
辛拉面5连包,,20581596223,5,0.977762463147532,包装严实，运输很快，一直喜欢这种口味的辛拉面，易煮，口味正，6个月保质期，还有四个月才到保质期。不是快过期食品
辛拉面5连包,,20599739299,5,0.9999350861814568,真的很喜欢，完全超出期望值，发货速度非常快，包装非常仔细、严实，运送速度很快，很满意的一次购物，商品符合描述，主要是活动便宜，能省很多钱
辛拉面鲜虾5连包,,20631565887,5,0.976624425859505,全家都爱吃的面，面饼劲道，口感好，耐煮，不会烂坨坨的，火锅，宵夜必备！ 汤汁浓郁还有蔬菜包，营养全面，非常好！
辣白菜5连包,,20575134617,3,0.16015957466136432,日期一般，一月的，已经日期过半
辣白菜5连包,,20550429092,5,0.9999638061937045,宝贝收到了，卖家发货很快，物流很快，客服态度极好，很有耐心，给人一种亲切感，我很喜欢。还有精致的包装，高端的氛围；可见卖家很用心。
辣白菜5连包,,20595701260,5,0.7192346701534182,农心的泡面里，最喜欢的就是辣白菜口味的，每次连汤带面，能吃的一口不剩，煮的时候再加一个荷包蛋，真是再好吃不过了。
辛拉面5连包,,20549011495,5,0.9999521652463863,买过好多次了，面饼很好，破碎的不多，比较完整，辛拉面很好吃，辣辣的，很美味，值得购买，京东送货上门，还是非常方便的，希望之后再接再厉！
辛拉面5连包,,20580521497,5,0.9995594710507556,非常不错..面条劲道.味道巴适.很好吃的.汤汁也很鲜美.最主要可以通过自己的一些创意做法做成不同味道的泡面.让生活变的更加美好.
,,20537230676,5,0.9965129315432002,目前吃过最好吃的泡面，非油炸，吃着安全放心，真的有西红柿跟鸡蛋，太好吃了做活动买的，很划算呢，吃了继续回购推荐给爱吃泡面的朋友们！
,,20520498902,5,0.00890761013001018,冻干西红柿鸡蛋面，这款属于再次回购产品，方便快捷，口感好，冲上水，很快就能吃上一碗香喷喷的西红柿鸡蛋面，下次还会继续采购的！
,,20523840350,5,0.9998363256381262,终于收到货了，非常非常喜欢，做工精致漂亮，已经被很多人夸了，真的太开心了，已经是他家的忠实粉丝了，以后还会继续买买买的
,,20324019605,5,0.9999998704457304,一如既往的好品质，非常喜欢的一款产品，非常棒！o(*￣︶￣*)o价格很实惠，性价比很高，算是平价好物，会回购的
,,19972362832,5,0.9977278181905741,别人推荐的，吃了，真的好好吃啊，，，真爱了呀，真好吃呀，吃完了后面再买！实惠好吃。开心?
,,20337705940,5,0.5239888961842389,这个面小孩子非常非常喜欢吃，一次买了三件，小孩每天都要吃一个
,,20292583648,5,0.3113043816277512,一直买小杯的，这次买大杯的看看。比方便面好吃，我喜欢加点榨菜丝进去。
,,20430023373,5,0.5900357069066685,这么说吧，确实是最不像方便面的方便面！口感好！
,,20085565380,5,0.8520104370006188,味道还不错，比方便面好吃多了！
,,20630621040,5,0.8871055277553717,之前在动车上买了一次，味道超级新鲜，到京东买到了，味道很赞，强烈推荐
,,20300388946,5,0.8791138695706475,经常购买这个品牌的方便面，口味非常适合，好评！
,,20473736177,5,0.967144996533734,味道很不错，小孩很喜欢
,,20090492861,5,0.8643743007910286,配料表干净，味道可以，就是酸了些。
,,20280595545,5,0.9455601076887048,这款面是非油炸的，北方便面吃了健康
,,20353696554,5,0.5255326820419541,非常点好吃，吃了还想买，就是
,,20313712027,5,0.9486461200373147,东西不错，味道也挺好。
,,13138950163,5,0.6110115162400632,爱上了，泡了一次 煮了一次 感觉真的像现场制作的，吃了不油腻 料很足，尤其是煮着吃很香！
,,13524348318,5,0.9998535761010396,第二次购买了。工作关系，有时候要方便面应急。吃过不少，这款算印象深刻的，我第一次把方便面汤喝光了。以前吃的方便面多数有胡椒之类的，要么太油了，汤不好下口。番茄酸汤口，还是很合我口味的。面本身也很不错，结合汤头，挺爽滑。
,,13931234377,3,0.7770813296710639,性价比一般般就那样疫情备粮用，放着不吃了
,,13694231988,5,0.9717277293270213,买过小碗的西红柿鸡蛋面，很爱吃。这次赶上有活动，还是大碗，必须拿下。西红柿的味道浓浓的，和自家做的差不多&hellip;&hellip;喜欢，推荐！
葱油拌面6盒,,20548656479,5,0.999786050487541,很香的泡面，不错。多次购买了，味道很好，葱油面很香很香，也不会很咸，刚好适合我这个广东人的口感，自带碗的很方便，快递很快，隔天就到了
火鸡面小龙虾拌面6盒,,20560918336,5,0.9593977057510804,白象的拌面，包括火鸡面在内的方便面，拌面比较适合普通人吃的口味，并没有那么辣，但是吃起来是那种香辣的感觉，一份的分量保证八分饱的状态，面饼很劲道
火鸡面小龙虾拌面6盒,,20559867131,5,0.27041024846888173,面条口味不错，，买过2次了。。包装很严实，，路上不会坏，，快递也快，，小孩和家人都喜欢吃，，，早上起来拿一下饼子，美味的早餐就好了，搭配稀饭吃，正好
葱油拌面6盒,,20612697999,5,0.9374840574337682,吃过几次，很合我口味。白象的方便面，有很多款的味道都不错的，国货是支棱起来了。这次购买了1箱6盒。下次再试试其他口味
椒麻鸡丝拌面6盒,,20608409266,5,0.9999861749544684,很香很好吃的拌面系列，孩子很喜欢，操作也很简单方便，小朋友独立就能完成，真的是很不错，推荐给朋友也说很好吃，不断回购的产品
椒麻鸡丝拌面6盒,,20550436792,5,0.18786205011639878,好吃，独立包装，收拾起来也方便的很。椒麻味又是我的最爱，回购了无数次，以后还会吃吃其他的味道，希望白象能加大力度。。。。
椒麻鸡丝拌面6盒,,20565821256,5,0.9998481285416431,第一次买白象干拌方便面味道的确不错，面条口感非常劲道，吃着也不油腻，辣味也刚刚好。价格也非常实惠，份量也很足，性价比非常高。国货老品牌值得信赖。
葱油拌面6盒,,20543180164,5,0.18005763460277424,很好吃 就是量有点少 打开竟然是筷子 不是叉子 很方便  包装严实 快递很快 葱油味道很浓郁   酱料包很好吃 还会再来的
火鸡面小龙虾拌面6盒,,20564394347,5,0.09236948761013808,味道可以的，和韩国的那个火鸡面比辣度低一点，但是也很辣，已经吃了两袋，发现变成平时那么煮也可以，而且汤没有那么辣，也特别想，真的是好评，包装送来很完好，总之好评！
辣椒炒肉拌面6盒,,20621050116,5,0.9999193001209047,支持良心的爱国企业白象，泡面的味道也非常不错，有时候懒得做饭，来上一碗还是挺好吃的，不比那些进口的品牌差，加油加油加油。
火鸡面小龙虾拌面6盒,,20585553004,5,1.0,作为一名消费者，我非常高兴能分享我的使用体验。这款产品真的很好吃，味道非常好。我觉得它的优点主要体现在以下几个方面:首先，它的口感非常棒。每一口都能感受到丰富的口感和层次感，让人回味无穷。其次，它的味道真的很出色，不仅仅是甜度适中，还有一股独特的香气，让人一尝难忘。最后，它的包装设计也很吸引人，让我在购物时都会忍不住多看几眼。总体来说，我对这款产品非常满意。它不仅让我在品尝美食的同时，也能享受到一种愉悦的购物体验。我强烈推荐给大家，希望大家也能尝试一下，找到属于自己的美味。
椒麻鸡丝拌面6盒,,20566584162,5,0.999938306537753,多次购买了，味道是我喜欢的，辣味十足，价格也是很划算的。都很好吃，非常不错。支持民族企业，推荐购买。
辣椒炒肉拌面6盒,,20603453730,5,0.9959521257253897,啥也不说了，支持白象不是没道理，味道好极了，孩子爱吃我也爱吃，都说不要多吃方便面，可我觉得超级赞，为什么少吃？给个赞超棒的
火鸡面小龙虾拌面6盒,,20566685571,5,0.7627953112342301,物流很快包装完美无破损，白象拌面，国货之光，一箱六盒麻辣小龙虾、火鸡拌面两种口味，面饼份量足易泡发，根据个人喜好放拌面酱，口感好。
葱油拌面6盒,,20542705138,5,0.9986371345191326,这款拌面量特别大，而且调料丰富，非常好吃，和现做的一样，是出行路上的完美伴侣，而且京东物流的速度特别快，当天就到了，很满意
火鸡面小龙虾拌面6盒,,20563410452,5,0.999951580568672,五星好评：这是一个好评模板，因为本大佬很懒，不想每个产品都写好评，所以特意写下这个模板，以前不知道评论可以涨积分，现在才知道好评的重要性，妥妥的，每天都评论一下，赚积分下次还能抵现金，用评论80字以上，可以得到50个积分，我无论买什么东西，都会把这段话复制粘贴一下，凑够字数，这是第n次在网上买东西了，棒棒棒，东西便宜而且质量又好，物美价廉，买的放心，用的开心，感觉都，上瘾了，买买买，根本停不下来，东西品种多，而且又特别划算，方便，而且实惠包装很好，而且没有任何损坏，会一直支持下去的，服务还可以，也超级好用，好评，下次再来!
火鸡拌面12盒,,19285591505,3,0.6250676707246816,火鸡面还是要买正版的
椒麻鸡丝拌面6盒,,20613947639,5,0.9963237905706,支持国货，支持白象方便面，线下超市的白象方便面太少了，也没网上的口味种类齐全，买一些备着当干粮还是不错的，也不是太辣，很棒
椒麻鸡丝拌面6盒,,20618905265,5,0.9999999998315978,非常值得信赖的品牌，质量有保障，价格还亲民，相当满意宝贝收到，物流很快，描述相符，比较满意，好评，推荐跟描述的是一样的，很显高档，物美价廉，要买的朋友可以下单噢！想买的别犹豫哇！没有廉价的感觉，很高端，特别棒！白象方便面，支持支持！面特别好吃！
火鸡拌面12盒,,20618174873,5,1.0,这款食品真是美味极了！每一口都充满了丰富的口感和独特的味道，让人回味无穷。无论是食材的新鲜度还是烹饪的工艺，都展现出了极高的品质。它的味道既传统又创新，完美地融合了各种食材的精华，让人吃得津津有味。而且，它的包装精美，既方便携带又适合作为礼物送给亲朋好友。总的来说，这款食品不仅满足了味蕾的享受，还给人带来了愉悦的心情，是真正的美食佳品！无论是自己品尝还是招待客人，都是绝佳的选择。
【10包】买5加5,混合口味,20598009546,5,0.9999286956210353,精挑细选很久，最后决定买这一款，到货后果然没有让我失望，实物很漂亮，做工很精细，特别满意
【5包】买3加2,酸酸辣辣豚骨面,20348781763,5,0.9999692195187975,东西很nice，就是这个邮政快递送了快一周 这个商品的质量真的很好！外观精美，手感舒适，使用起来非常顺手。卖家的服务态度也很好，让我购物无忧。
【5包】买3加2,韩式辣牛肉汤面,20348764855,5,0.9999770558181562,东西很nice，就是这个邮政快递送了快一周 卖家的服务真是贴心周到！他们提供了专业的建议，帮助我选择了合适的商品。物流速度也很快，让我顺利收到了商品。
【5包】买3加2,罗宋汤面,20332280171,5,0.9999649751583335,我真的非常喜欢它，非常支持它，质量非常好，和卖家描述的一模一样，我非常满意。我真的很喜欢它，它完全超出了预期的价值，交货速度非常快，包装非常仔细和紧凑，物流公司有一个良好的服务态度，交货速度非常快，我非常满意购物
【5包】买3加2,混合口味,20290821098,5,0.7435407389362428,东西很nice，就是这个邮政快递送了快一周
【15包】买10加5,混合口味,20647630332,5,0.15890236156104676,面条劲道，汤特别好喝，口味都凑齐了。
【5包】买3加2,酸酸辣辣豚骨面,20594846751,5,0.7462912949129005,快餐面，今天下午收到了，包装的挺好的，没有压得碎碎的还满意
【10包】买5加5, 日式豚骨拉面,20327505205,5,0.9003352486605339,一直买这个品牌的面，好吃，物美价廉。
【5包】买3加2, 海鲜拉面,20563670114,5,0.6879530063202648,已经买好几次了，物美价廉！
【15包】买10加5,混合口味,20455828253,5,0.7471974311492248,一直喜欢吃汤达人，买的口味还可以混搭，好评
【15包】买10加5,混合口味,20547918544,5,0.9678928756285266,不错，买了很多次了。味道不错
【10包】买5加5,混合口味,20548357034,5,0.1468324946653694,我在外面买也就俩块五一包，你在网上卖三块多，还玩文字游戏
【10包】买5加5,混合口味,20657206230,3,0.7861383754920528,什么口味的都有很好，但是快递放的不是很好，有两包直接碎的差不多了
【5包】买3加2, 日式豚骨拉面,20637770342,5,0.0010772977209979606,方便面包装干得稀碎，完全没法吃，客服叫我开发新吃法。。。干得漂亮。直接退了。
【10包】买5加5,酸酸辣辣豚骨面,20337600482,5,0.04065804266435846,没法说，直接差评了。下次不会买了。
【5包】买3加2,韩式辣牛肉汤面,20399664996,5,0.03693352858669474,太慢了一个礼拜才收到
【15包】买10加5,混合口味,20610758695,1,0.05905092283832947,这个汤达人面就是假的，水里一煮就烂味道根本不对！
【5包】买3加2,酸酸辣辣豚骨面,20510053512,5,0.044420065497678296,靠，#儿，买的时候以为是买五小袋送两小袋，结果是买三送2等于5小袋，单选不同口味比官方还贵，买个屁买
【10包】买5加5, 日式豚骨拉面,20598041014,5,0.7163051619310785,超喜欢日式豚骨面
【5包】买3加2,韩式辣牛肉汤面,20358689759,5,0.8205283699617819,日期新鲜  赞一个
多半红烧牛肉面,,20554193279,5,0.0037165731309035666,物流配送好快，送到有电话联系，还有短信通知，拿到快递拿回宿舍就泡了一包来吃，泡面分量很足，味道也好吃，一点不比某师傅差。
多半金汤肥牛面,,20585978667,5,0.9999946563093809,白象多半金汤肥牛面，味道醇厚鲜美，肥牛与金汤完美融合，让人回味无穷。面条劲道爽滑，每一口都充满满足感。这款方便面，不仅方便快捷，更带来了绝佳的味蕾享受。
多半金汤肥牛面,,20620260648,5,0.9999999911014202,真的推荐啊，快递速度特别的快，爱了爱了想买的别犹豫哇！没有廉价的感觉，很高端，特别棒！真的很好，性价比也很高，质量也很好，物流也快啊！一天就到货了！价格实惠，质量杠杠的，非常好的一次购物，下次还来
多半香辣牛肉面,,20566922117,5,0.9997060306685572,这款白象方便面是全家人的最爱，每次想吃方便面都在京东买这款白象的，口感好，味道鲜美，京东物流特别快，今天下单明天就送到，感谢京东这么好的购物平台！
多半红烧牛肉面,,20600963089,5,0.999706422167599,白象红烧牛肉面足量足价，面饼很大，味道也是肉鲜味十足，棒棒哒。京东食品安全做得到位，吃的放心。京东小哥发货快，送货时效高。
多半香辣牛肉面,,20654177383,5,0.9361594145381624,白象面很好啊，最近看这个又是新品种汤好喝什么的都是吃过了，这个面头一回买，看看怎么样，包装很好，还给单独来了个小箱子，没有碎的，回头吃过了再来追评吧，先到这儿了，
多半金汤肥牛面,,20639982468,5,0.971890647942604,白象方便面的金汤肥牛面，味道超赞！浓郁的金汤汤底，搭配鲜嫩的肥牛，让人一口接一口。面条劲道爽滑，口感绝佳。真是一款让人满足的方便面！
多半红烧牛肉面,,20643444107,5,0.9986190206236831,白象牌红烧牛肉面感觉很不错，1，面做的不错很劲头泡开后也很好，2，调料也很好，牛肉味很大。包装很好没有破袋。方便食品常备，以解不时之需。有时挺想吃方便面的。
多半香辣牛肉面,,20545933645,5,0.9966556411703232,在京东网购己多年，刚开始抱着试试看的心情，到现在一切大大小小的生活家居用品，日常生鲜水果，大到家用电器，小到笔墨纸砚等等都在京东解决，图的就是放便快捷，品质有保证，价格合理，售后放心。   对自营的产品非常放心，品质和服务也有保障。收到货后仔细检查一番，包装各个方面都没有损坏，非常完好。快递人员也是态度非常好，能够按时间及时送达，保质保量，特别赞一下。  总之京东上的东西质量有保证，买着放心用着舒心。客服也很好，消费者权益有保障，在京东上买的东西耐心，质量经的起考验，推荐大家购买！
多半红烧牛肉面,,20654986201,5,0.6880482310704938,白象方便面吃过很多，以前一直吃的汤好喝。这次换换口味，看看有没有惊喜，就这几袋还给我整了个独立小包装，不得不说京东快递真是太到位了
多半红烧牛肉面,,20600441193,5,0.9999883291075545,真的超级喜欢，非常支持，质量非常好，与卖家描述的完全一致，非常满意，真的很喜欢，完全超出期望值，发货速度非常快，包装非常仔细、严实，物流公司服务态度很好，运送速度很快，很满意的一次购物
多半香辣牛肉面,,20576416582,5,0.9999998855999737,首先为京东物流点赞!时效性非常强！赞白象香辣牛肉面，品质非常值得信赖，面条劲道，汤很好喝，很美味！总得来说是一次很棒的购物体验!
多半红烧牛肉面,,20631061721,5,0.973325861919349,京东自营就是快上午下单晚上就到了 这款白象方便面 非常好吃 味道好极了 家里人都喜欢吃 继续回购 信赖京东 推进给朋友
多半金汤肥牛面,,20575633285,5,0.9068394948216345,白象的这款方便面味道很不错，价格也不贵，关键它是国产品牌，支持国货，我买国货的方便面一点不比外资的差，面饼很大很实惠，以后还会回购！
多半红烧牛肉面,,20618672382,5,0.999999345640257,宝贝和想象中差不多所以好评啦，对比了很多家才选择了这款，还是不错的，很NICE！真的不管是质量还是款式都是我喜欢的会继续关注支持店铺哒希望卖家多出新款，继续剁手买买买！！！铁子们真的很不错！买它买它买它！你值得拥有！信我的准没错哈哈哈！
多半香辣牛肉面,,20578664271,5,0.9996545113078129,好像是新款，闺女没吃过，安排！好评！ 这个商品的质量真的很好！外观精美，手感舒适，使用起来非常顺手。卖家的服务态度也很好，让我购物无忧。
多半香辣牛肉面,,20617993624,5,0.5393685433507702,非常好的一次购物体验，一直相信京东自营的质量保证。京东快递是唯一一个会送货上门的快递，不需要去驿站拿。京东的售后也是一流的。一直是忠实的plus会员。
多半金汤肥牛面,,20612680478,5,0.9998914816435324,买来搁家里周末吃着休闲的，支持一下白象，吃完再买哈哈 卖家的服务真是周到细致！他们不仅耐心解答我的问题，还给予了很多实用的建议。物流速度也很快，让我及时收到了商品。
