ProductColor,ProductSize,ID,score,sentimentScore,content
黑曼巴/ATX/标配3只风扇,,20696496621,5,0.14332292319412865,机箱够大 布局合理 背面的位置很大可以轻松的理背线 机箱很重风扇自带3个风力强劲 还能装光驱位置 硬盘也留了很大的地方 装机过程丝滑 给了二种防尘网可以的 很好的商品
新品上市/T21黑色/ATX/360水冷,,20671637226,5,0.999984604426891,内部空间：很富余，安排合理散热效果：非常好五面网孔，三面防尘网外形外观：低调简约 沉稳大气做工质量：尚可 相比十年前产品用料更轻薄 设计更合理 前面板框塑料有毛刺两个角比较尖锐，最好配合防撞垫使用。
新品上市/T21黑色/ATX/360水冷,,20663406451,5,3.0508727100975186e-05,这个机箱很好看，机箱是透明的玻璃，老公说四方胶垫老化了，有噪音。所以买了这款机箱。完全没有机器启动的噪音。很好。散热也不错。有防尘垫。容易打扫清洁卫生
黑曼巴F1/ATX/标配3只风扇,,20677875154,5,0.7331997496781134,东西是挺好的，物美价廉，主要快递慢了一点，一次就能点亮，主板bios界面操作很简易，开内存xmp简简单单，组装还挺容易的，处理器功耗控制的不错，基本4铜管的散热器可以烤鸡做到70以内，主板扩展功能也不错， matx规格小机箱刚刚好。
黑曼巴F1/ATX/标配3只风扇,,20675330605,5,0.9995705914274632,用料扎实，做工精细，还有隔音棉，现在这种好的机箱真的好难找。内部空间也大，走背线没有压力。特别是物流速度，快递小哥的服务没得挑。给个大大的赞！
F70 白/ATX/360水冷/40系显卡,,20698787918,5,0.9518357020303501,人生第一次组装电脑，选来选去还是这款颜值最得我心，容积大，不拥挤，主板安装很方便，电源仓设计合理，走线很清爽，风扇位充足，还有防尘垫，非常棒！
新品上市/T21黑色/ATX/360水冷,,20669513667,5,0.9999999999999998,1. 非常满意的一次购物体验！商品质量非常好，与卖家描述完全一致，包装也非常仔细，物流速度很快，服务态度也很好。客服人员非常耐心地解答了我的问题，让我非常感动。这是我在京东购物的第一次体验，但绝不会是最后一次。我会一直支持京东，也会向我的朋友们推荐京东。感谢京东为我们提供了这么好的购物平台，祝愿京东越来越好！2. 这个价格仍然很划算。经济、便宜、质量非常好，与卖方描述的完全一样。非常满意，完全出乎意料，超划算，划算，购物比实体店便宜多了，非常满意网上购物。我希望卖家的生意会越来越红火，物流会越来越快，包装会越来越结实。六星表扬，多一星不怕你骄傲，犹豫不决的朋友会很快下单，这是良心的推荐。它真的很好，而且价格也很高，所以你将来可以在这里买。给三个好评就满足了！满意了！满意了！
新品上市/T21黑色/ATX/360水冷,,20638951811,5,0.9998876459670567,趁着优惠，赶紧入手，是正品，包装也非常的好，没有破损，质量也是没得说，棒特别特别棒，货比三家才买的，店主人很好，回答问题很有耐心，也很详细，有需要还会再来的
F70 黑/ATX/360水冷/40系显卡,,20605161172,5,0.00011235233774620212,应该说还是不错的，机箱很大，我也特意是买的大机箱为了这散热好，另外一个好处就是显卡长度可以不受限制了，我的显卡是三风扇的，可以达到28厘米，所以大机箱就是好，另外可以加装9个12厘米的风扇，应该降温是可以的，不打算买水冷了，后期等装完了以后再看实际的效果。
黑曼巴/ATX/标配3只风扇,,20653833637,5,0.998442587771784,京东自营首选考虑，虽然价格没有优势，但是正品有保证，就算出现问题，退货服务也很OK，一直是plus会员，网店购物京东是首选，目前为止国内服务还是选京东，最主要是发票有保证，不要操心。
F70 白/ATX/360水冷/40系显卡,,20628030599,5,0.9999955940891049,内部空间：空间还挺大的，因为买的650的板子，所以看起来小马拉大车了做工质量：提起来有点分量，主要在玻璃散热效果：到处都是散热口，还不错外形外观：简单大方产品包装：还行吧
黑曼巴F1/ATX/标配3只风扇,,20662394391,5,4.55376047214795e-06,机箱挺好的，铁面板，没有光污染，是我喜欢的，内部隔音棉质量也很好，前后自带3风扇，还可以自己加一把风扇，散热没问题！就是usb和耳机插口没有带防尘塞。
黑曼巴F1/ATX/配3把静音风扇,,14069197064,3,0.05547230281280957,**的开关和USB插座位置
新品上市/T21黑色/ATX/360水冷,,20698944676,5,0.9931011957628346,好，两台办公电脑，本来想入集显的，结果I5集显没货，就整一套I5昂达主板昂达显卡和一套R5技嘉主板铭瑄显卡，内存都是光威的16G不过一个是DDR5一个是DDR4，硬盘都是移速的，电源爱国者使用足够稳定，这相机箱也买了好几个了，办公还是不要侧透的，都是一次点亮，使用稳定没问题。
黑曼巴/ATX/标配3只风扇,,20672070180,5,1.3825275407386428e-05,爱囯者，电脑行业的老品牌，现在机箱的样子越来越酷，性能又增加，前置4个USB带风扇调速和读卡器，自带3个12cm风扇，机箱顶盖可以设换密封板和防尘网模式。
新品上市/T21黑色/ATX/360水冷,,20596358043,5,0.9902144908728971,价格实惠，大小合适，散热风道很好走，就是机箱的前面两个角很尖锐，套了两个防撞的才舒服了，买它就是因为它前脸好拆，未来清灰方便。
DIY个性化主题定制,,19854521594,5,0.25727919885940775,老板，服务可以的，东西没得错
DIY电脑免费写配置【咨询在线客服】,,17449702861,5,0.09928912174037674,此用户未填写评价内容
DIY电脑免费写配置【咨询在线客服】,,17429797245,5,0.9797384073835106,收到了，质量很好，很满意的一次购物值得推荐好评
DIY电脑免费写配置【咨询在线客服】,,17428233841,5,0.9844422203896595,卖家态度很好，很喜欢，速度很好，建议大家购买
DIY电脑免费写配置【咨询在线客服】,,17424198783,5,0.9999725829962782,运行速度不错，游戏效果好外观外形好看安装，方便其他什么都满意。
预算用途免费写配置【咨询在线客服】,,17419269454,5,0.9940456450749272,质量保证，运行速度快，安装简单，性价比高
预算用途免费写配置【咨询在线客服】,,17417949118,5,0.9999998068894194,包装很好，质量很不错。做工也很好，材质也很不错。运行速度也很快。打游戏很快。很满意
预算用途免费写配置【咨询在线客服】,,17417293245,5,0.9612552529611778,很不错，满意
风之灵 白色（纯白风扇）,,20645590614,5,0.9970231603849486,感觉挺不错的，好看也有颜值，带俩前置散热风扇，还支持前置tpc口，应该是最有性价比的了吧。都说白色不耐脏，但是感觉还好吧
风之灵 白色（双USB3.0）,,20680621743,5,0.0011048303270631,师傅送的是真的快，给师傅打了一个电话，让帮忙送快点提前给我送来了。机箱也就正常，能用，这个价格买到也很可以了
自由之翼 白色（送4把ARGB风扇）,,20465002968,5,0.9826243742576981,机箱很大，用量扎实，钢板很厚实，感觉能用很多年，就喜欢这种简约大气风格，放包纸给你们看一下大小，里面布局也合理，推荐购买，这两天一直在下暴雪，显卡要过几天才能送过来，没来得及装机，先放着，有机会再追评
 风之翼 白色（送1把ARGB风扇）,,20389649515,5,0.9994969924654324,这个价位应该是无敌的，确实就是这个价位的做工，200块你想要做工极致好的，去选长城阿基米德，但那个只有黑的，而且没有送风扇集线器，要什么自行车呢，这个前板快拆也是挺不错的了，就是防尘网的磁贴贴的不是很好，歪了，不影响使用，2023性价比之王
风之翼 黑色（送1把ARGB风扇）,,20536554789,5,0.97579962275057,货真价实，高颜值，高品质，一分钱一分货，材质外观和质量一看就很上档次，非常喜欢
风之灵 黑色（RGB风扇）,,20448835068,5,0.9973776042995208,东西很不错，趁着京东搞活动的时候就入手了，性价比很高，两个大风扇还是挺炫酷的，就是整个几箱支持的风扇数量不够，以后有需要还是会一如既往地支持京东自营的
风之灵 黑色（RGB风扇）,,20117707715,5,0.846969119614928,看了很久，无意中看到这个机箱，觉得散热不错自带2个风扇，然后下单了，到手是两层纸箱包裹着很不错，大小也合适刚好放在房间。装机时候遇到一点小问题联系客服解决最后安装好了，实物会图片好看很多。
风之灵 黑色（RGB风扇）,,20163396887,5,0.013904265759649426,非常酷炫，一次点亮，个人非常喜欢这个机箱，海景房太多了，还是这种比较好看。唯一缺点是没重启键，前面usb接口才一个，比较少了
风之灵 黑色（RGB风扇）,,20126950133,5,0.9993474929488658,双层纸箱保护到位外形简约，送两个16的大风扇  前上下 3 面都配了防尘网好评 机箱整体很不错，铁皮稍微有点薄前接口不多，显卡挡板是一次性不过这个价位已经很细节了总体很好 体积小巧好看，主要能装atx板子  价格便宜还送两个大扇子
风之灵 白色（纯白风扇）,,20174361128,5,0.9999964108034369,不错，朴实，耐看，实用。装的微星550m主板，配的5600g做个办公机，挺好用的。质量看着也不错，侧透很好看。忘记拍照片了，实物比图片要好看很多
风之灵 白色（纯白风扇）,,20176238556,5,0.9999999992867639,"机箱很不错内部空间：空间够宽裕atx板子完全够了做工质量：做工不错，细节很好散热效果：送两把风扇散热真不错外形外观：外观还可以 就普通机箱产品包装：两层包装很好很用心很扎实"
风之灵 白色（纯白风扇）,,20174195986,5,0.9999999983828427,"内部空间：内部空间很符合设计理念，设计合理，用料利用率很高做工质量：做工扎实，机箱用料很不错散热效果：散热效果很好，机箱有一种质朴的美感外形外观：外观还不错，前面两个白色风扇很好看"
风之灵 白色（纯白风扇）,,20174211357,5,0.9996423788635131,非常好，小巧精致，客服热情，价格便宜，螺丝也送了很多，产品两层外包装也很厚实，加上京东送货万无一失，十分棒的购物体验。
风之灵 黑色（RGB风扇）,,20169939352,5,0.9992852720430843,机箱收到了，颜色好看质量也特别好，终于找到了一款自己喜欢的，喜欢的朋友们可以放心入手，而且快递也很给力超赞
风之翼 黑色（送1把ARGB风扇）,,20322571820,5,0.18068438047889723,做工很好的小机箱，适合放桌面上，这款没有侧透，没有玻璃更安全，侧板开孔多更有利于散热，机箱做工也挺好，稳固，安装也顺手。
风之灵 白色（纯白风扇）,,20176251223,5,0.9999999997212772,"特别棒京东自营当天就到，双层包装也很棒，产品也很棒很棒很棒很棒内部空间：够用做工质量：质量很好散热效果：很不错，很多风扇位子，还送了两个风扇外形外观：外观很帅，加上风扇灯光更帅产品包装：非常棒，"
风之灵 白色（纯白风扇）,,20176247015,5,0.9967204727142541,京东物流真的很快，这款机箱，性价比很高，机箱整体做工优秀，安装也很方便，大面积的散热网孔，通风散热效果也不错，背部有理线空间，安装后效果不错，好评！！
风之灵 白色（纯白风扇）,,20176247739,5,0.9987929356638096,京东物流速度很快，送货上门真的很方便。两层包装严实，盒子里面泡沫防震保护很好，机箱做工质量很好，整体结构扎实，散热效果好，外观非常漂亮，细节设计到位，前面板、顶部、底部的通风口处均有磁吸防尘网
风之翼 黑色（送1把ARGB风扇）,,20401584399,2,1.0062439770308629e-10,我就没买过机箱螺丝卸不下来的机箱，售后给我换了一个，这新换的到好，机箱螺丝是卸下来了，机箱背板后面针脚都是歪的，虽然我用不到，但是看着就是不舒服啊，服了，懒得换了就这样吧，大家千万别买除了京东其他平台都找不到的产品！
风之翼 黑色（送1把ARGB风扇）,,20335972636,5,0.013992209621232043,非常实用的机箱，百元的最好选择，质量颜值都很在线，而且京东的快递确实快，头天晚上下单，第二天上午就送到了，这款机箱的尺寸很紧凑，不会占太多地方
新品上市/JV13黑/MATX/RGB灯条,,20696021264,5,0.9339750867461665,机型大小用来装微星b760、七彩虹4060、双塔散热，尺寸刚好合适，没有太多浪费空间，质量也很好，顶部的网片可以单独取下来清洗灰尘，非常有人性化设计。
新品上市/JV13白/MATX/RGB灯条,,20616950728,5,0.9499901210380088,这机箱还挺好看理线空间也大，挺不错，白色质感也很好，玻璃做了黑化，非常的帅气，会再次回购的一款机箱，兼容性也不错，没啥太大的槽点。
A15/ATX/左侧透,,20608854719,5,0.9617957350804794,爱国者的机箱，质量很好，做工很精细，价格也很实惠，布局合理，搭配爱国者电源刚刚好，京东物流也非常的给力，第一天下单第二天就送达。
M2钛灰/M-ATX/240水冷,,20660900214,5,0.24906455368503688,内部空间：非常不错！选了好几个，这个最好看，内部空间也大，非常满意做工质量：质量非常好，唯一缺点就是线竟然不是屏蔽的，20多块钱的都是屏蔽的！
A15/ATX/左侧透,,20655459977,5,0.9999975778286366,好!!不错，款式挺满意的，挺喜欢的，发货速度非常快，包装非常仔细、严实，物流公司服务态度很好，运送速度很快，很满意的一次购物。
A15/ATX/左侧透,,20656393276,5,0.21252717885049688,包装的超级严实，验货时没有一点问题，特地等了几天以后才安装好，安装好用了一周了，打好几个游戏非常舒服，
新品上市/JV13白/MATX/RGB灯条,,20640459763,5,0.9748069186927475,电脑机箱非常好，做工精致，大小合适，有氛围灯，可以调多钟颜色，重启键和灯光控制二选一内部空间：MATX主板的大小外形外观：非常好看，白色的产品包装：很好，回来一点磕碰没有
新品上市/JV13黑/MATX/RGB灯条,,20676740235,5,0.14073179657418444,机箱不错，做工扎实，可以支持MATX主板、最长350mm的显卡、最高160mm的CPU散热器，对于大部分主流的散热器和显卡来说，它都是可以轻松安装的。 M2的钢化玻璃侧板设计的，非常有意思，机箱的底部带有一个抽拉式的防尘网。支持顶置12cm*2、前置12*2和后置12*1的散热风扇，相当大气。
新品上市/JV13白/MATX/RGB灯条,,20639886977,5,0.9998171100652878,内部空间：非常适配做工质量：质量很好，玻璃比较厚，是很硬的散热效果：散热效果很好外形外观：这个外观是非常上档次的，内置一目了然产品包装：快递非常的快，包装非常严实，里面的泡沫很安全
新品上市/A15白色/左侧透,,20676544486,5,0.9983544950377109,颜值是自己喜欢的类型，白白的，看着很干净。做工很好，边角处处理得很顺滑，质感蛮不错。透明的机箱，里面的配料清晰可见，感觉非常好。
新品上市/JV13黑/MATX/RGB灯条,,20669292465,5,0.9037676453774783,很不错的机箱，外观简约大气，内部结构合理，机箱上边的灯条可以切换不同的模式，虽然占用了重启键的功能，不过都是可选的。满意的一次购物。
新品上市/JV13白/MATX/RGB灯条,,20699334681,5,0.307758290084278,爱国者这个机箱，颜值在线。整体结构设计没有明显的瑕疵，前面板的灯光颇有&ldquo;画龙点睛&rdquo;的妙处，十分&ldquo;亮眼&rdquo;。京东物流效率十分给力
新品上市/JV13黑/MATX/RGB灯条,,20629021595,5,0.098071924789778,机箱很简约，安装简单，感觉百元机首先且无对手，还有rgb灯条，属实很良心，快递很快就到了，昨晚上买的，今天就到了，很好看！
A15/ATX/左侧透,,20700727215,5,0.9916826056669508,宝贝收到了！实物和图片是一致的！质量 和质感都挺不错的呢！很满意！喜欢喜欢！商家服务态度也很好！问问题 回复解答也挺快的！发货速度也不慢！很满意的一次网购消费！
新品上市/JV13黑/MATX/RGB灯条,,20701006470,5,0.9996209663340502,作为一个消费者，我非常高兴有机会评价这款机箱。在使用过程中，我发现这款机箱有许多值得称赞的地方。首先，这款机箱的设计非常人性化。它采用了宽敞的结构，使得安装硬件变得非常方便。同时，它的散热性能也相当出色，能够有效地帮助保持电脑的稳定运行。其次，这款机箱的材质非常坚固，给人一种非常可靠的感觉。它能够承受一定的压力和冲击，这对于那些经常需要移动电脑的用户来说非常重要。
新品上市/JV13黑/MATX/RGB灯条,,20699212886,5,0.026784402579534405,第一次买这种小机箱，之前用的都是很大的，不过这种小的可以放在桌面上，很方便，不用担心孩子乱摸，装里面的零件也都很实用，电脑装好了用着顺手
A15/ATX/左侧透,,20670489017,5,0.959609776246029,价格实惠量又足，很不错，第三次买了，大机箱放显卡比较好操作，黑色也可以，耐克，用料还是足的，很不错。侧面透明的设计还是需要弄点灯才好看
A15/ATX/亚克力全侧透,,14746967007,3,0.9430578968288486,就这样吧，符合这个价位的品质
新品上市/JV13黑/MATX/RGB灯条,,20653976596,5,0.3508703250318448,非常不错 值得购买，第一台机箱里面线断了，也顺利换货。包装也很好，配送及时，机箱内部空间也够大，布局合理，在办公室用机箱大小也刚刚好。以后会回购的，
新品上市/JV13白/MATX/RGB灯条,,20673067634,5,0.9961627033245247,机箱很好看，而且价格很实惠，纯白色的颜值很耐看的，兼容大主板，长显卡，主打一个性价比下置电源还是很不错的，机箱其实有这个样已经不错了，没必要再上更高了。好评！
风华B310黑/MATX/兼容360水冷,,20658307206,5,0.0549251741993626,这两天京东IT在搞促销，第一天购买第二天就到了，包装很好，机箱覆盖面的钣金很厚实，目测有0.8mm左右，塑料件的接口也很好，还带主流的usb3.0接口！
风华B310黑/MATX/兼容360水冷,,20630943133,5,0.001026445916561869,质优价廉，才花了一百多块钱，前面板可以摘下来，右侧面板方便走背线，总体不错，虽然出了点儿问题，但是商家能补发货品，左侧玻璃面板能看到里面这点挺好的
T500海景房白 ATX/type-c接口 ,,20435700667,4,0.9944436307868249,蛮不错的，比较轻便，不会太重还支持背插，确实喜欢。就是个别背插版型不能上，有点小瑕疵，其余都不错，
T500海景房黑 ATX/type-c接口,,20476052158,5,0.4472590096072716,尺寸和颜值是我想要的，空间够大，做工精细，9把风扇一点不影响机箱内部散热，两个USB3.0和音频口再加一个TYPE- C口，功能接口齐全配置强大，安装360水冷无压力!
T500海景房白（ATX/type-c接口）,,20088215375,5,0.9999996088630727,机箱质量不错 风扇也炫酷，玩游戏各种碾压，包装完好，很结实，一次点亮，温度压的很好，整体效果很好，开机8s，运行流畅，加装了风扇，散热效果不错，没什么声音。很不错，价格实惠，东西好用。散热给力，装机箱酷炫给力！
风行D510黑/EATX/双360水冷位,,20114000858,5,0.04538080496208896,做工精细 孔位几乎完美适配ssi-eeb（305mm*330mm），前面板镂空完美。如果能出个非侧透版本就更好了！！！前置双USB 3.0好评！！！真的就不理解了，为什么那么多型号，非得强行缩水一个无比宝贵的前置usb3.0！！！
T500海景房白（ATX/type-c接口）,,20069703254,5,0.9989431116202898,在安装T500的过程中，我发现T500机箱的双仓并列式设计和串联式布置让理线太过简单，超前的支持背插式主板，更有助于打理出一个整洁、有序的机箱内部环境。多达9个风扇位，无论是水冷散热、风扇安装、风冷散热、电源兼容性、主板兼容性、显卡支持还是硬盘兼容性，都为用户提供了丰富的选择和组装灵活性，满足不同玩家的需求。更关键的是价格、价格，还是价格！超频三T500机箱设计十足、用料十足、诚意十足，这么一款十足的玩家机箱仅
T500海景房黑 ATX/type-c接口,,20235239617,5,0.9978601386662272,一如既往的快速到货，机箱很宽敞，玻璃看起来很透亮，磨具打磨整体做工给人眼前一亮的感觉，总的来说很不错，期待装机后效果，电脑配件还没到齐，先拍拍机箱内部照片吧。
T500海景房白 ATX/type-c接口 ,,20224747362,5,0.9931743744394148,做工扎实，颜值很高。刚刚收到货开箱的时候着实惊艳到我了，给我眼前一亮的感觉，现在就等其他的配件到，然后装机了。
T500海景房白（ATX/type-c接口）,,20113932087,5,1.0,这款机箱简直太逆天了！刚拆开包装就感受到了它的高质感，光滑的金属外壳，散发着时尚感与科技感的光泽，让人眼前一亮。不仅外观精致，内部设计更是令人惊叹。它拥有宽敞的空间，能容纳大量的硬件设备，让我无需担心扩展和升级的问题。别看它小巧玲珑，却能提供强大的散热能力。内置的多个风扇和通风孔设计，能保持我的电脑在高负荷运行时的稳定，让我再也不用担心过热造成的性能下降或是硬件损坏的情况。除此之外，这款机箱还考虑到了用户的实际需求。它提供了丰富的外部接口，让我方便地连接各种设备，如USB、音频接口等，使用起来非常便捷。而且，它还采用了智能控制技术，可以实现风扇转速调节和灯光颜色变化等个性化设置，让我的电脑变得更加个性化和独特。总的来说，这款机箱不仅在外观设计上非常吸引人，更重要的是它的功能和性能都非常出色。无论是游戏、办公还是创作，它都能满足我不同的需求。强大的散热能力和用户友好的设计，让我在使用中完全没有后顾之忧。如果你正在寻找一款性价比高、功能强大又漂亮的机箱，那么这款绝对是你的不二之选！
风行D510黑/EATX/双360水冷位,,20113999860,5,0.04538080496208896,做工精细 孔位几乎完美适配ssi-eeb，前面板镂空完美。如果能出个非侧透版本就更好了！！！前置双USB 3.0好评！！！真的就不理解了，为什么那么多型号，非得强行缩水一个无比宝贵的前置usb3.0！！！
T500海景房白（ATX/type-c接口）,,20103849954,5,0.9995433223397747,机箱用料扎实，做工细致，超频三的品质感一如既往。白色搭配亮面玻璃，海景房设计颜值很高，兼容ATX、Matx等主流规格主板。
T500海景房白 ATX/type-c接口 ,,20297341063,5,0.9999479454785724,海景房的设计让机箱的颜值拉满了，机箱内部空间设计的宽敞大方，硬件升级起来相当方便。在这分享一下我的电脑角落，每一次开机都是一场视觉盛宴！总的来说，选择这款机箱真是明智之举，不仅提升了我的电脑性能，还让整个电脑区域更加有趣和时尚了！
T500海景房白（ATX/type-c接口）,,20106428220,5,0.9999775021348583,海景房，挺好看内部空间：够大，剩余空间多，可以多放点装饰。做工质量：不错，材料用的可以，散热效果：没问题，支持9个风扇位，我装了3个，然后装了240水冷。外形外观：挺大气，比较上档次，看着就挺好看。
T500海景房黑 ATX/type-c接口,,20222521413,5,0.9781022047733909,还不错的机箱，比想象的要好，左右两侧都是类似于侧开门，没有那种传统的螺丝，设计不错，机箱空间看着也不错，挺好；已经开始期待装好的样子了。
T500海景房黑 ATX/type-c接口,,20224514399,5,0.9999999840676359,送货超快，性价比高，包装与配件简洁够用。无立柱海景房设计漂亮，外部尺寸紧凑，内部空间够宽敞，能上ATX大板，梳子内存条高了点，***D15风扇往上提了点，高度也正好够用。挑了半天也就这款最合适了。
T500海景房白（ATX/type-c接口）,,20159768465,5,0.038122363570033735,这款机箱用料还是挺足的，钢板不算薄也不割手，空间大走线很方便，还有上type-c接口比较实用。价格不算贵还有京东自营售后和送货速度，满意
风行D310白/MATX/兼睿280水冷,,20334519952,5,0.9937756182215182,体积刚刚好 兼容性也不错 正面mesh真滴帅 可惜没有快拆和typec 如果出一个plus版本就好了
